author,id,comment,sentiment,timestamp,like_count,tipe_produk,brand,segment,release_date,text_processed
@greenvlog,771,Nyimak harganya berapa bang ????????,positive,2024-06-10 10:39:31+00:00,0,Realme 12 Pro 5G,Realme,Mid-Range,24-Feb,menyimak harganya bang
@alhafeezy2277,772,Kamera tele itu gunanya buat apa ya ka?,negative,2024-06-09 08:07:36+00:00,0,Realme 12 Pro 5G,Realme,Mid-Range,24-Feb,kamera tele gunanya iya kakak
@syaifulhaqqi2097,773,Susah ga si om main ML pake layar curved??,negative,2024-06-03 15:33:43+00:00,0,Realme 12 Pro 5G,Realme,Mid-Range,24-Feb,susah tidak sih om main ml pakai layar curved
@ytprem-in4hz,774,Yg realme 12+ 5G laah bg,positive,2024-05-31 14:43:20+00:00,0,Realme 12 Pro 5G,Realme,Mid-Range,24-Feb,realme 12 5g bagi
@lymm9652,775,Mending di kumpulin dulu siapa tahu tahun depan bnyak yg murah ??,negative,2024-05-29 07:15:22+00:00,0,Realme 12 Pro 5G,Realme,Mid-Range,24-Feb,kumpulkan murah
@bagussyafeiofficial8808,776,Suaranya buat nonton YouTube kencang ga,positive,2024-05-27 13:06:20+00:00,0,Realme 12 Pro 5G,Realme,Mid-Range,24-Feb,suaranya menonton youtube kencang tidak
@Omnivysenickhok,777,"dapet di harga 4,7 ni di tiktok wkwk untung banyak",positive,2024-05-25 08:53:06+00:00,0,Realme 12 Pro 5G,Realme,Mid-Range,24-Feb,harga 4 7 nih tiktok wkwk untung
@3.arifrochmanchakim884,778,bang rekomendasi mending realme 12 pro + apa redmi note 13 pro 5g?,positive,2024-05-24 10:23:58+00:00,0,Realme 12 Pro 5G,Realme,Mid-Range,24-Feb,bang rekomendasi realme 12 profesional redmi note 13 5g
@NikatraTayga,779,Bang menurut mu kalo soal kamera mending realme 12pro plus 5g atau samsung a55 5g?,negative,2024-05-23 07:57:36+00:00,0,Realme 12 Pro 5G,Realme,Mid-Range,24-Feb,bang mu kamera realme 12pro plus 5g samsung a55
@BambangIrawan-lc3oy,780,Kameranya sama kek relmi 5 pro sama sama pake sensor camera sony,positive,2024-05-22 12:53:25+00:00,0,Realme 12 Pro 5G,Realme,Mid-Range,24-Feb,kameranya sama kayak relmi 5 profesional pakai sensor camera sony
@cekmii8145,781,Bg bagaimana cara buat ke mode ultra di mobile legend bg?,neutral,2024-05-12 10:25:41+00:00,0,Realme 12 Pro 5G,Realme,Mid-Range,24-Feb,bagi mode ultra mobile legend
@MuhammadRizky-ht7mw,782,apa benar bisa 120 x zoom ?,negative,2024-05-10 15:27:36+00:00,0,Realme 12 Pro 5G,Realme,Mid-Range,24-Feb,120 x zoom
@DHEKA12OFFICIAL,783,"Btw mau tanya untuk kamera nya apakah ada 0,5 nya?",neutral,2024-04-18 16:30:49+00:00,0,Realme 12 Pro 5G,Realme,Mid-Range,24-Feb,by the way kamera nya 0 5
@feryandriyanto3982,784,Saya beli adeknya yg + saja,neutral,2024-04-17 05:03:01+00:00,0,Realme 12 Pro 5G,Realme,Mid-Range,24-Feb,beli adeknya
@hunterxgamesindonesia3365,785,"""Genshin impact itu bisa di lock 60 fps, caranya di non aktifin auto resolution di game enginenya""",neutral,2024-04-12 06:48:17+00:00,0,Realme 12 Pro 5G,Realme,Mid-Range,24-Feb,genshin impact lock 60 fps non aktifin auto resolution game enginenya
@ndrycihuy,786,"""Ini kameranya cuma 3 aslinya ya atau semuanya fungsi.. Lagi bingung mau ambil ini, reno 11 atau v30""",negative,2024-04-10 07:08:13+00:00,0,Realme 12 Pro 5G,Realme,Mid-Range,24-Feb,kameranya 3 aslinya iya fungsi bingung ambil reno 11 v30
@michaeltumewu2202,787,"""Nunggu adek nya di review realme 12+""",neutral,2024-04-10 04:39:17+00:00,0,Realme 12 Pro 5G,Realme,Mid-Range,24-Feb,menunggu adik nya review realme 12
@MuhammadAthar1113,788,"""dia support wireless charging ga sih ka""",neutral,2024-04-06 15:48:30+00:00,0,Realme 12 Pro 5G,Realme,Mid-Range,24-Feb,support wireless charging tidak sih kakak
@bonnyhanafidacosta1071,789,"""ada gorilaglass nya? klo ada kelas berapa?""",neutral,2024-04-06 01:53:09+00:00,0,Realme 12 Pro 5G,Realme,Mid-Range,24-Feb,gorilaglass nya kelas
@sabaruddinsitumorang5069,790,"""Harga berapa di medan""",neutral,2024-03-31 10:50:39+00:00,0,Realme 12 Pro 5G,Realme,Mid-Range,24-Feb,harga medan
@kisaragi3944,791,"""Diliat dari thermal vision bagian kameranya a beneran mirip jam, ada jarumnya jg""",negative,2024-03-31 06:18:51+00:00,0,Realme 12 Pro 5G,Realme,Mid-Range,24-Feb,dari thermal vision kameranya a benaran jam jarumnya
@faruqfaruq3667,792,"""Kalau ini dicompare kan dengan poco x6 pro 5g itu mending mana bang ?""",negative,2024-03-29 19:15:33+00:00,0,Realme 12 Pro 5G,Realme,Mid-Range,24-Feb,dicompare poco x6 profesional 5g bang
@imambukhori4655,793,"""Ada Esim gk realme 12 pro plus?""",negative,2024-03-27 15:13:38+00:00,0,Realme 12 Pro 5G,Realme,Mid-Range,24-Feb,esim tidak realme 12 profesional plus
@mrzkananda,794,"""Jadi bingung mau beli 13T atau 12pro+ ÂÂ¤Â""",negative,2024-03-24 21:10:26+00:00,0,Realme 12 Pro 5G,Realme,Mid-Range,24-Feb,bingung beli 13t 12pro â
@yanto7553,795,"""emang kadang orang gila chipset paling anti namanya fps dibawah 60, padahal mah buat apa bisa unlock 60fps tapi naik turun ga stabil samsek, mending yg cuman 30fps rata""",negative,2024-03-24 00:05:06+00:00,0,Realme 12 Pro 5G,Realme,Mid-Range,24-Feb,kadang orang gila chipset anti namanya fps 60 unlock 60fps tapi turun tidak stabil sama 30fps
@mancingserasok2418,796,"""Sma yg 12+ mana yg lbih bagus""",positive,2024-03-23 17:35:50+00:00,0,Realme 12 Pro 5G,Realme,Mid-Range,24-Feb,sama 12 bagus
@andrewsetiabudi46,797,"""Yang pre order kok chipset nya dimensity 7050 ya ? Ini kok snapdragon?""",negative,2024-03-21 12:47:11+00:00,0,Realme 12 Pro 5G,Realme,Mid-Range,24-Feb,pra order chipset nya dimensity 7050 iya snapdragon
@kimmi8948,798,"""sd870 itu sama kayak chipset 7s gen2 ngga? atau gmna. tlong pencerahannyaaaa""",negative,2024-03-21 02:07:28+00:00,0,Realme 12 Pro 5G,Realme,Mid-Range,24-Feb,sd870 sama kayak chipset 7 gen2 tidak tlong pencerahannyaaaa
@kenzi8785,799,apa ada yg versi 256GB internal ya om?,neutral,2024-03-16 15:16:25+00:00,0,Realme 12 Pro 5G,Realme,Mid-Range,24-Feb,versi 256gb internal iya om
@DikaYulisti,800,"Realme 12+ 5G vs Redmi 13pro 5G. Mending ambil yang mana bang ? Buat laporan harian kerja, fotoÃ¯Â¿Â½ sama game tipisÃ¯Â¿Â½",neutral,2024-03-15 20:03:48+00:00,0,Realme 12 Pro 5G,Realme,Mid-Range,24-Feb,realme 12 5g lawan redmi 13pro ambil bang laporan harian kerja fotoã â â½ sama game tipisã
@relanydiro9304,801,Review realme 12+ juga dong,positive,2024-03-15 18:51:12+00:00,0,Realme 12 Pro 5G,Realme,Mid-Range,24-Feb,review realme 12
@rakasurya5092,802,"Permisi mau nanya, ini aku baru beli tapi yang 12+ nah saya curiga plastiknya kayak hasil repack, tapi si seller bilangnya tidak repack. Dan ku cek status garansinya, sudah keluar perkiraan masa garansi berakhir, yaitu 9 Maret 2025. Minta tolong kasih infonya, itu repack atau bukan ya? Soalnya plastiknya itu kayak habis dipanasin pakai hair dryer gitu, tapi overall rapi dan plastiknya tipis. Sudah coba tanya di grup FB, eh malah ditawarin hp.",negative,2024-03-15 10:24:41+00:00,0,Realme 12 Pro 5G,Realme,Mid-Range,24-Feb,permisi baru beli tapi 12 curiga plastiknya kayak hasil repack sih seller bilangnya tidak ku cek status garansinya perkiraan garansi 9 maret 2025 tolong kasih infonya iya habis dipanasin pakai hair dryer overall rapi tipi coba grup facebook eh ditawari handphone
@hendynooctariandy4033,803,rentang harga yg sama poco x6 5g dg realme 12 pro+ worth it mana yah,positive,2024-03-14 04:29:59+00:00,0,Realme 12 Pro 5G,Realme,Mid-Range,24-Feb,rentang harga sama poco x6 5g realme 12 profesional worth it ya
@NinoTok,804,Saat perekaman video udah bisa pindah2 kamera nggak bang?,neutral,2024-03-13 15:13:50+00:00,0,Realme 12 Pro 5G,Realme,Mid-Range,24-Feb,perekaman video pindah2 kamera bang
@fariedaditya3875,805,menarik,positive,2024-11-10 07:48:55+00:00,0,Realme 12 Pro 5G,Realme,Mid-Range,24-Feb,menarik
@LuthfiKienah,806,Nonton nya lagi pake realme 12 pro plus,positive,2024-10-28 15:04:21+00:00,0,Realme 12 Pro 5G,Realme,Mid-Range,24-Feb,menonton nya pakai realme 12 profesional plus
@BudiSumarno-d3x,807,Mau review 12+5g pak,neutral,2024-10-04 02:24:00+00:00,0,Realme 12 Pro 5G,Realme,Mid-Range,24-Feb,review 12 5g
@FaiqkNgeBlues87,808,Saya Masi pakek realme 8pro dan Masi sangat puas,positive,2024-09-17 00:07:56+00:00,0,Realme 12 Pro 5G,Realme,Mid-Range,24-Feb,sai pakai realme 8pro puas
@brotony71,809,"Saya apresiasi realme yg berani kasih kamera telephoto periscop,yg gk tau kamera periscip cuma ada di hp flagship yg harganya puluhan juta,dan ini di pake di hp 6-7jt saya udh pake kamera telenya mantap lah,beda jauh sama kamera tele biasa",positive,2024-09-04 16:02:46+00:00,0,Realme 12 Pro 5G,Realme,Mid-Range,24-Feb,apresiasi realme berani kasih kamera telephoto periscop tidak periscip handphone flagship harganya puluhan juta pakai 6 7jt telenya mantap beda sama tele
@irvanagus894,810,pengen beli ini untuk hape ketiga saya. msh pake maxpro m1 dan vivo T1 5G (batre udah kena/soket nya karena ngecas nya lama banget sampe 4 jam baru penuh) alasan utama pgn beli hp lagi ,positive,2024-09-03 13:35:10+00:00,0,Realme 12 Pro 5G,Realme,Mid-Range,24-Feb,beli telepon genggam ketiga pakai maxpro m1 vivo t1 5g baterai kena soket nya ngecas lama banget 4 jam baru penuh alasan utama handphone
@yuddyimowanto9338,811,Hape ini terbaik di kelasnya!,positive,2024-08-07 12:48:52+00:00,0,Realme 12 Pro 5G,Realme,Mid-Range,24-Feb,telepon genggam terbaik kelasnya
@TutorialNext,812,Jempol buat realme ini,positive,2024-06-13 06:04:56+00:00,0,Realme 12 Pro 5G,Realme,Mid-Range,24-Feb,jempol realme
@CahButonChannel,813,"Sudah beli, keren sekali kameranya",positive,2024-04-27 05:26:17+00:00,0,Realme 12 Pro 5G,Realme,Mid-Range,24-Feb,beli keren kameranya
@ahmadfauzi9273,814,Adaaaa chargernya!!!,neutral,2024-04-23 15:45:20+00:00,0,Realme 12 Pro 5G,Realme,Mid-Range,24-Feb,adaaaa chargernya
@FebriRahmadayani,815,"Bagus sampel camera untuk objek manusianya yaitu laki"" jd halal",positive,2024-04-14 15:54:30+00:00,0,Realme 12 Pro 5G,Realme,Mid-Range,24-Feb,bagus sampel camera objek manusianya laki halal
@xp7994,816,"""Menurutku mending beli yang varian 12+5G aja, beda tipis doang sama yang pro+, prosessor jg sama""",negative,2024-04-08 04:32:36+00:00,0,Realme 12 Pro 5G,Realme,Mid-Range,24-Feb,menurutku beli varian 12 5g beda tipi doang sama profesional prosessor
@iqseventy,817,"""Kalo fix software Juara di kelasnya""",positive,2024-03-22 03:17:51+00:00,0,Realme 12 Pro 5G,Realme,Mid-Range,24-Feb,fix software juara kelasnya
@wahyunurhadi7553,818,"""Gw dari pertama keluar realme 3 pro sampai sekrang masih bagus gak ngeleg gak ngulah dan gak neko neko jadi kedepan pingin upgrade ke realme tipe lain tapi dana belum cukup wkwkkwkw semoga habis lebaran ada duitnya bis beli yg ini""",positive,2024-03-20 13:28:04+00:00,0,Realme 12 Pro 5G,Realme,Mid-Range,24-Feb,gue dari realme 3 profesional bagus tidak ngeleg ngulah peningkatan tipe tapi dana belum wkwk semoga habis lebaran duitnya bi beli
@afafshiddiqoh5521,819,Alhamdulillah SDH kebeli warna beige yg mau beli g usah ragu Ã¢ÂÂ¤,positive,2024-03-16 09:52:09+00:00,0,Realme 12 Pro 5G,Realme,Mid-Range,24-Feb,alhamdulillah kebeli warna beige beli tidak ragu ã â
@jerilanipi2482,820,msh bertahan dg realme 5 pro ,positive,2024-03-14 11:01:42+00:00,0,Realme 12 Pro 5G,Realme,Mid-Range,24-Feb,bertahan realme 5 profesional
@Egaalfariz123,821,Bingung gua mending zero 30 apa hot 50 pro¢,negative,2024-11-04 12:52:21+00:00,0,Infinix Zero 30,Infinix,Mid-Range,24-Aug,bingung gue zero 30 hot 50 profesional
@gufronwahyudi5616,822,Bang mending infinix note 40 4g atau zero 30 4g,positive,2024-10-31 05:58:14+00:00,0,Infinix Zero 30,Infinix,Mid-Range,24-Aug,bang infinix note 40 4g zero 30
@RatnaHidayat-de2qw,823,"Ragu mau beli infinix karena saya fikir kok bisa speaknya gahar gahar tapi harganya murah, bisa jangka panjang gk?",negative,2024-10-29 13:49:31+00:00,0,Infinix Zero 30,Infinix,Mid-Range,24-Aug,ragu beli infinix pikir speaknya gahar tapi harganya murah jangka tidak
@sandypramana2994,824,Zero 30 sma note 40 lebih worth it mana bang?,negative,2024-10-25 10:50:10+00:00,0,Infinix Zero 30,Infinix,Mid-Range,24-Aug,zero 30 sama note 40 worth it bang
@JUDISLOTMEMBUNUHMU,825,"""Hot 50pro+ Murid Infiniz Zero30 GURU Ã¢ÂÂ Jgn sombong dulu lu bray KALO DI ADU KAMERA PHOTO DAN VIDEO JELAS KALAH TELAK..""",negative,2024-10-24 19:34:24+00:00,0,Infinix Zero 30,Infinix,Mid-Range,24-Aug,hot 50pro murid infiniz zero30 guru ã â sombong bro adu kamera photo video kalah telak
@fadliika,826,Infinix emang gak suka jack audio yaa note 40 juga gak ada ngincer nya biar bisa main pubgÂÂÂ,negative,2024-10-21 11:56:56+00:00,0,Infinix Zero 30,Infinix,Mid-Range,24-Aug,infinix tidak suka jack audio ya note 40 mengincar nya biar main pubgâ â
@putuBali_1,827,Bagusan mana Infinix zero 30 5g atau xiaomi note 13 pro 5g ya?,negative,2024-10-16 12:44:20+00:00,0,Infinix Zero 30,Infinix,Mid-Range,24-Aug,bagusan infinix zero 30 5g xiaomi note 13 profesional iya
@Ã£ÂÂÃ£ÂÂÃ£ÂÂ³Ã£ÂÂÃ£ÂÂ©Ã£ÂÂ¸Ã£ÂÂ§,828,"S21 ultra saya serasa sampah ..melihat kemampuan hp ini untuk performa, dan ketahanan baterai , padahal hp saya tidak pernah di pakai main game , dan sekarang BH ny 78% saja , infinix anda membuat saya menyesal memiliki flagship ini . ¢¢",negative,2024-10-05 12:50:39+00:00,0,Infinix Zero 30,Infinix,Mid-Range,24-Aug,s21 ultra serasa sampah kemampuan handphone performa ketahanan baterai tidak pakai main game bh nya 78 infinix menyesal memiliki flagship
@anggaraerlangga5982,829,xiaomi apa infinix bang buat jangka waktu panjang?,neutral,2024-10-01 13:35:24+00:00,0,Infinix Zero 30,Infinix,Mid-Range,24-Aug,xiaomi infinix bang jangka
@maurinafajry4683,830,dri kamera bagus note 40 atau yg zero ini..?,positive,2024-09-28 13:24:53+00:00,0,Infinix Zero 30,Infinix,Mid-Range,24-Aug,dari kamera bagus note 40 zero
@agungalvarest7304,831,Saran dong mending ambil ini apa yang note 40 ya?,negative,2024-09-18 17:07:25+00:00,0,Infinix Zero 30,Infinix,Mid-Range,24-Aug,saran ambil note 40 iya
@lulukwulan819,832,"""zero 30 Sayang banget ngga ada memori external¢+ ngga ada wirelles charging¢ 30 pro sayang banget letak cameranya kaya asal""""an¢+kurang bagus foto/video¢""",negative,2024-09-03 02:13:31+00:00,0,Infinix Zero 30,Infinix,Mid-Range,24-Aug,zero 30 sayang banget tidak memori external wirelles charging profesional letak cameranya kayak an bagus foto video
@rizkyindratmadja4729,833,mending ini apa note 40 pto ys,neutral,2024-08-28 10:36:33+00:00,0,Infinix Zero 30,Infinix,Mid-Range,24-Aug,note 40 pto y
@parabangAgusty,834,"Kelemahan infinix adalah...tombol"" kurang timbul Dan tdk ada ukuran headset yg biasax dan getaranx kurang enak",negative,2024-07-30 15:36:46+00:00,0,Infinix Zero 30,Infinix,Mid-Range,24-Aug,kelemahan infinix tombol timbul tidak ukuran headset biasax getaranx enak
@randaajja8410,835,Speaker bazz nya gak ada selain itu sic oke infinik,negative,2024-07-30 15:33:35+00:00,0,Infinix Zero 30,Infinix,Mid-Range,24-Aug,speaker bazz nya tidak sic oke infinik
@butterflytzu,836,"sekarang 2,6 juta¢ mending ini apa samsu** m15 5g­",negative,2024-07-20 02:16:05+00:00,0,Infinix Zero 30,Infinix,Mid-Range,24-Aug,2 6 juta samsu m15 5g
@VinoNugie,837,Bang kasih saran mending mana sama infinix 40 pro,negative,2024-07-04 03:32:03+00:00,0,Infinix Zero 30,Infinix,Mid-Range,24-Aug,bang kasih saran sama infinix 40 profesional
@RamadhanAziz-pw3yz,838,Bagusan Zero 30 apa gt 20 pro,neutral,2024-06-30 07:34:28+00:00,0,Infinix Zero 30,Infinix,Mid-Range,24-Aug,bagusan zero 30 20 profesional
@wawaniskandar3866,839,Ke Vivo v30 gua,neutral,2024-06-28 14:13:32+00:00,0,Infinix Zero 30,Infinix,Mid-Range,24-Aug,vivo v30 gue
@SellaArtika,840,"""kalo sama poco m6 pro, bagus mana y? saran donk!!!""",negative,2024-06-26 15:03:27+00:00,0,Infinix Zero 30,Infinix,Mid-Range,24-Aug,sama poco m6 profesional bagus iya saran
@eriknuralamsyah34,841,"Balik lagi ah , bg menurut saya infinix ini kalo buat maen game cuma 2bulan enaknya, skarang maen game nge stuck terus buat saya yg budget paspasan agak nyesel si beli ni HP ÂÂ¥Â²",negative,2024-06-22 16:01:23+00:00,0,Infinix Zero 30,Infinix,Mid-Range,24-Aug,ah bagi infinix main game 2bulan enaknya nge stuck budget paspasan menyesal sih beli nih handphone â â²
@sandrisandri154,842,Kalau desainnya sdh ok fitur2nya lumayan cuma infinix kalahnya kwalitas speakernya kurang ok mending beli VIVO Y100 4G kwalitasnya lbih dri infinix,positive,2024-06-15 13:26:21+00:00,0,Infinix Zero 30,Infinix,Mid-Range,24-Aug,desainnya oke fitur2nya lumayan infinix kalahnya kualitas speakernya beli vivo y100 4g kualitasnya dari
@AhmadRamdani-ip5gc,843,"""Lebih mending mana Infinix note 40 apa infinix zero 30 Mohon saran""",negative,2024-05-23 22:53:55+00:00,0,Infinix Zero 30,Infinix,Mid-Range,24-Aug,infinix note 40 zero 30 mohon saran
@dwipurnomo1400,844,bang david mending pilih mana infnix Zero 30 4G atau note 40 4G ?,neutral,2024-05-20 02:25:24+00:00,0,Infinix Zero 30,Infinix,Mid-Range,24-Aug,bang david pilih infnix zero 30 4g note 40
@balapceskalteng5467,845,kekurangan invinix cuma di jaringan aja sih,negative,2024-05-18 23:22:23+00:00,0,Infinix Zero 30,Infinix,Mid-Range,24-Aug,kekurangan invinix jaringan sih
@bambangirawan,846,Hp buruk murah main ML ngeframe ngelek parah,negative,2024-05-14 14:48:28+00:00,0,Infinix Zero 30,Infinix,Mid-Range,24-Aug,handphone buruk murah main ml ngeframe ngelek parah
@muhammadabimnugraha3024,847,enakan zero 30 5g atau note 40 bang?,negative,2024-05-07 09:16:00+00:00,0,Infinix Zero 30,Infinix,Mid-Range,24-Aug,enakan zero 30 5g note 40 bang
@YuliAnti-qs8ji,848,Kira kira bagusan infinix zero 30 atau note 40 ya,neutral,2024-05-01 11:39:43+00:00,0,Infinix Zero 30,Infinix,Mid-Range,24-Aug,bagusan infinix zero 30 note 40 iya
@FanyFany-m2u,849,Bang lebih mending note 40 pro atau zero 30?,negative,2024-04-30 23:53:20+00:00,0,Infinix Zero 30,Infinix,Mid-Range,24-Aug,bang note 40 profesional zero 30
@cantiklaa7939,850,mending ini versi 5G / Note 40 pro ya??­,negative,2024-04-30 04:30:30+00:00,0,Infinix Zero 30,Infinix,Mid-Range,24-Aug,versi 5g note 40 profesional iya
@aliudin1301,851,"knp ya gw pake ni hp mail ml leg"" apa lg pas war¢",neutral,2024-04-30 04:29:38+00:00,0,Infinix Zero 30,Infinix,Mid-Range,24-Aug,iya gue pakai nih handphone mail ml leg pa war
@khowanxz2783,852,Kalo di bandingin sama not 40 menang mana bang,neutral,2024-04-22 08:25:00+00:00,0,Infinix Zero 30,Infinix,Mid-Range,24-Aug,bandingkan sama not 40 menang bang
@rafikhairan3356,853,Ini chipset nya yg sebenarnya apa si di chenel lain mediatek 8020 disni g99 lagi aduh,negative,2024-04-21 17:36:07+00:00,0,Infinix Zero 30,Infinix,Mid-Range,24-Aug,chipset nya sih chenel mediatek 8020 g99 aduh
@fernandoalexander8366,854,"""Kalau buat main game sama live tik tok game nya nge frezz Emng sih murah kamera bagus tapi kalah nya kalau main game terus buka apk lain nya suka lag patah patah baru pemakaian seminggu sedikit kecewa tapi gak papa lah""",negative,2024-04-17 07:35:53+00:00,0,Infinix Zero 30,Infinix,Mid-Range,24-Aug,main game sama live tik tok nya nge frezz sih murah kamera bagus tapi kalah buka suka lag patah baru pemakaian seminggu kecewa tidak papa
@shirokuro6206,855,Umi ku baru dapet hp ini terus tadi ku hantam main game roblox pet simulator 99 lumayan ngelag.,negative,2024-04-08 20:18:18+00:00,0,Infinix Zero 30,Infinix,Mid-Range,24-Aug,umi ku baru handphone hantam main game roblox pet simulator 99 lumayan ngelag
@227_dianayulestari2,856,Mending ini apa Xiomi note 13 pro,negative,2024-04-06 15:37:04+00:00,0,Infinix Zero 30,Infinix,Mid-Range,24-Aug,xiomi note 13 profesional
@HemaAyusita,857,bang knp ya kamera belakang zero 30 blur apa setingan nya aku ga faham,negative,2024-04-06 06:35:11+00:00,0,Infinix Zero 30,Infinix,Mid-Range,24-Aug,bang iya kamera zero 30 blur setingan nya tidak paham
@katambang,858,Heran 3 juta masih nyandingin kamera gimmick,negative,2024-04-02 22:13:24+00:00,0,Infinix Zero 30,Infinix,Mid-Range,24-Aug,heran 3 juta nyandingin kamera gimmick
@jigenn_8,859,4:33 kamera gimmick ,neutral,2024-03-30 04:04:13+00:00,0,Infinix Zero 30,Infinix,Mid-Range,24-Aug,4 33 kamera gimmick
@ininamasayabudi,860,hp infinix minesnya suka restrat sendiri... mending dipertimbangin lagi,negative,2024-03-18 17:04:38+00:00,0,Infinix Zero 30,Infinix,Mid-Range,24-Aug,handphone infinix minesnya suka restrat dipertimbangin
@faiz9358,861,ada rumor g99nya make g77mc9 beneran ga si,neutral,2024-03-22 03:11:25+00:00,0,Infinix Zero 30,Infinix,Mid-Range,24-Aug,rumor g99nya make g77mc9 benaran tidak sih
@yusuf8612,862,"infinix zero 30 4g vs tecno pova 5 pro menang mana kira"" bos?",neutral,2024-03-21 16:01:51+00:00,0,Infinix Zero 30,Infinix,Mid-Range,24-Aug,infinix zero 30 4g lawan tecno pova 5 profesional menang bos
@antonikazza2630,863,Bang mau tanya dong saya mau beli infinix tapi masih bingung mau yg zero 30 atau not 40,neutral,2024-03-21 12:56:42+00:00,0,Infinix Zero 30,Infinix,Mid-Range,24-Aug,bang beli infinix tapi bingung zero 30 not 40
@jakasaputra9891,864,Coba gt ultra bang,neutral,2024-03-21 03:59:52+00:00,0,Infinix Zero 30,Infinix,Mid-Range,24-Aug,coba ultra bang
@jakasaputra9891,865,Kalo versi gt dan ultra masih bagus yg mana bang dari versi zero,negative,2024-03-21 03:39:04+00:00,0,Infinix Zero 30,Infinix,Mid-Range,24-Aug,versi ultra bagus bang dari zero
@goopofficial7588,866,Intinya lebih bagus 4g atau yang 5g,positive,2024-03-21 03:31:46+00:00,0,Infinix Zero 30,Infinix,Mid-Range,24-Aug,intinya bagus 4g 5g
@secretperson103,867,mending ini apa note 30 pro?,negative,2024-03-20 15:41:58+00:00,0,Infinix Zero 30,Infinix,Mid-Range,24-Aug,note 30 profesional
@muhammadramdanlubis9702,868,Kalo jaringan nya sudah 5 g blm ka,neutral,2024-03-18 05:06:31+00:00,0,Infinix Zero 30,Infinix,Mid-Range,24-Aug,jaringan nya 5 tidak belum kakak
@JUDISLOTMEMBUNUHMU,869,"""Kalo Seandainya Hp infinix diharga 3jtan layar Melengkung pakai bahan Material full Metal ""TAMAT""""",positive,2024-03-15 13:10:09+00:00,0,Infinix Zero 30,Infinix,Mid-Range,24-Aug,seandainya handphone infinix diharga 3jtan layar melengkung pakai bahan material full metal tamat
@Sindofendisa-ve7ru,870,"tapi sekarang udah turun harga nya turun bang 2,500 juta",negative,2024-11-08 08:05:42+00:00,0,Infinix Zero 30,Infinix,Mid-Range,24-Aug,tapi turun harga nya bang 2 500 juta
@AIMUSIK-t1v,871,"Punya sya yg 4g sudah dpt update android 14,tp untuk suaranya mash enak yg android versi 13",positive,2024-11-01 04:12:10+00:00,0,Infinix Zero 30,Infinix,Mid-Range,24-Aug,4g pembaruan android 14 suaranh enak versi 13
@gurusdku3235,872,Kalau mau rekam buat video pembelajaran ukin sampai 2jam bisa bang?,neutral,2024-10-18 10:04:32+00:00,0,Infinix Zero 30,Infinix,Mid-Range,24-Aug,rekam video pembelajaran ukin 2jam bang
@Oppoa95-b5u,873,Bisa pake jaringan 4G/5G,neutral,2024-10-09 19:23:00+00:00,0,Infinix Zero 30,Infinix,Mid-Range,24-Aug,pakai jaringan 4g 5g
@arsanarsan312,874,"Ya bang kalau audio mono itu bas lebih kenceng,",negative,2024-10-09 06:28:54+00:00,0,Infinix Zero 30,Infinix,Mid-Range,24-Aug,iya bang audio mono ba kencang
@ropikbae5863,875,"""Hari ini baru beli yg sekenn...dpt harga 1.950.... Liat vidio ini bagus bnget hp ny.. pas cek barang nya malahan lebih kerennn pas udh liat langsung....mntp....main game ringan rata kanan no lag""",positive,2024-10-06 17:40:03+00:00,0,Infinix Zero 30,Infinix,Mid-Range,24-Aug,baru beli sekenn harga 1 950 lihat video bagus banget handphone nya pa cek barang keren langsung mantap main game ringan kanan no lag
@BidadariCucit-cd3sl,876,"Kalau byk hp warna bagus gini, jangan lg buat hp warna hitam.",negative,2024-10-03 10:40:25+00:00,0,Infinix Zero 30,Infinix,Mid-Range,24-Aug,handphone warna bagus hitam
@ApaAjaBoleh_AAB,877,Yg Infinix Zero 30 5G kapan XOS 14?,neutral,2024-09-22 18:31:59+00:00,0,Infinix Zero 30,Infinix,Mid-Range,24-Aug,infinix zero 30 5g xos 14
@agusmuncar4362,878,Suport by pass charging gak?,negative,2024-09-21 04:06:29+00:00,0,Infinix Zero 30,Infinix,Mid-Range,24-Aug,suport by pa charging tidak
@dedyms305,879,Ini udah dukung nyetel vidio 4k apa belom bank.,neutral,2024-09-19 04:14:33+00:00,0,Infinix Zero 30,Infinix,Mid-Range,24-Aug,dukung menyetel video 4k belum bank
@zonamusikmotivasi9841,880,Kira-kira masih worth it engga bang kalo dibeli sekarang ? Buat pemakaian daily aja,negative,2024-09-06 11:21:33+00:00,0,Infinix Zero 30,Infinix,Mid-Range,24-Aug,worth it tidak bang dibeli pemakaian daily
@fikhowijaya6485,881,Ada ultrawide ga?,neutral,2024-08-29 14:05:29+00:00,0,Infinix Zero 30,Infinix,Mid-Range,24-Aug,ultrawide tidak
@JokoPrahmono-pl8xk,882,Bagus gak kk buat game,negative,2024-08-19 17:07:09+00:00,0,Infinix Zero 30,Infinix,Mid-Range,24-Aug,bagus tidak kakak game
@Kampungaesthetic,883,"Ini hp dari semua chipset G99 yang pernah di coba, Note 30 pro Note 40 pro Tecno spark 20pro + ini paling enak paling adem, ni di pake se enak itu",positive,2024-08-09 06:20:34+00:00,0,Infinix Zero 30,Infinix,Mid-Range,24-Aug,handphone dari chipset g99 coba note 30 profesional 40 tecno spark 20pro enak adem nih pakai
@ichallpea125,884,Baru aja beli di harga 2.4 jt di official store nya infinix,positive,2024-08-04 10:32:19+00:00,0,Infinix Zero 30,Infinix,Mid-Range,24-Aug,baru beli harga 2 4 juta official store nya infinix
@Lethergerzy,885,Alhamdulillah skrg baru bisa kebeli ni hp untuk daily enak bgt puaslah pokoknya thkyu bg david sukses selalu,positive,2024-07-29 12:45:43+00:00,0,Infinix Zero 30,Infinix,Mid-Range,24-Aug,alhamdulillah baru kebeli nih handphone daily enak banget puaslah pokoknya thkyu bagi david sukses
@kareldakohta5561,886,Bang untuk infinix zero 30 ada by pas changing nya ngk ?,neutral,2024-07-23 15:55:12+00:00,0,Infinix Zero 30,Infinix,Mid-Range,24-Aug,bang infinix zero 30 by pa changing nya tidak
@sergioroddger,887,recomend ga sih buat 2 taun kedepan?,negative,2024-07-23 06:35:57+00:00,0,Infinix Zero 30,Infinix,Mid-Range,24-Aug,recomend tidak sih 2
@Peltato25,888,"Mending zero 30 apaa 20 , saya lagi cari ke kamera?? Semiga ada yg jawab makasih",negative,2024-07-19 00:01:50+00:00,0,Infinix Zero 30,Infinix,Mid-Range,24-Aug,zero 30 20 cari kamera semiga terima kasih
