author,id,comment,sentiment,timestamp,like_count,tipe_produk,brand,segment,release_date,text_processed
@jamessimamora5488,2602,"Hemat banget bang baterainya,sampai 28 jam 28 menit saat pengujian,dan berkurang 6% dalam 2 jam nonton local video 1080p,berarti berkurang 3% aja sejam.emang kalau hp samsung hemat banget baterainya jika dibandingkan dengan hp kapasitas sama.",positive,2024-11-03 14:03:05+00:00,1,Galaxy S24+,Samsung,Flagship,18-Jan-24,hemat banget bang baterainya 28 jam menit pengujian berkurang 6 2 menonton lokal video 1080p 3 sejam handphone samsung dibandingkan kapasitas sama
@syaifulrizal1299,2603,Nonton pake S24+ nyimak,neutral,2024-08-31 17:22:22+00:00,1,Galaxy S24+,Samsung,Flagship,18-Jan-24,menonton pakai s24 menyimak
@ezwarriansyah7085,2604,"Saya pencinta SAMSUNG sejak tahun 2010 dan sudah 4 kali menggunakan hp produk SAMSUNG dari yg slide B331 (2010-2014, Galaxy J2 2015 (2016-2023), Galaxy A54 5G (2023-2024) karena entah kenapa memberanikan diri upgrade ke Galaxy S24+ walau dengan pertimbangan yang sangat berat... Tapi intinya kalau sudah suka satu brand, maka akan selalu mengikuti terus....",positive,2024-06-20 14:43:02+00:00,1,Galaxy S24+,Samsung,Flagship,18-Jan-24,pencinta samsung 2010 4 kali handphone produk dari slide b331 2014 galaxy j2 2015 2016 2023 a54 5g 2024 memberanikan peningkatan s24 pertimbangan berat tapi intinya suka merek mengikuti
@gitagotama,2605,"""Setelah ambil s24+ baru nnton reviewnya,... sip jadi ngga nyesel ambil hp ini. Thankyou om""",positive,2024-03-29 08:24:05+00:00,1,Galaxy S24+,Samsung,Flagship,18-Jan-24,ambil s24 baru nonton reviewnya sip tidak menyesal handphone thankyou om
@FikkySyofyan,2606,"""mantap tim Jagat nonton pake S10+ yg update software nya March 2023, dah abis lagi membukatkan tekad kepengen ganti ke S24+ terima kasih JagatReview""",positive,2024-03-19 15:29:28+00:00,1,Galaxy S24+,Samsung,Flagship,18-Jan-24,mantap tim jagat menonton pakai s10 pembaruan software nya march 2023 habis membukatkan tekad ganti s24 terima kasih jagatreview
@riandisaputra5273,2607,"""MENYESAL BELI S24ULTRA. saran saya jangan beli samsung S24 ultra. kamera 50 dan 200 mp tidak berguna, post processing nya jelek banget alhasil foto hasilnya jelek even di SIANG hari ¢. dan ga ada di REVIEWE youtuber .. sampai november ini masih ga ada solusi yang pas dari samsung. JANGAN BELI HAPE S24 Ultra.""",negative,2024-11-09 20:43:29+00:00,1,Galaxy S24 Ultra,Samsung,Flagship,18-Jan-24,menyesal beli s24ultra saran samsung s24 ultra kamera 50 200 mp tidak berguna post processing nya jelek banget alhasil foto hasilnya even siang reviewe youtuber november solusi pa dari telepon genggam
@nurhidayah5588,2608,Ya Allah... Harga nya sama kayak motor Baru ­­­,negative,2024-10-22 05:47:42+00:00,1,Galaxy S24 Ultra,Samsung,Flagship,18-Jan-24,iya allah harga nya sama kayak motor baru
@ZACKY_AHMAD,2609,Ini camera ada brp bang..? katanya 3 aj yg bener.. ini lebih dari 3 bener kan ?,negative,2024-11-16 06:33:43+00:00,1,Galaxy S24 Ultra,Samsung,Flagship,18-Jan-24,camera bang 3 dari
@wdayff,2610,@gadgetin aku butuh saran mending s24 ultra atau ip 15 pro max?,neutral,2024-11-16 03:00:48+00:00,1,Galaxy S24 Ultra,Samsung,Flagship,18-Jan-24,butuh saran s24 ultra ip 15 profesional max
@tianbie243,2611,"Gue ttp setia di samsung a51.. pdhal kmrn udh mau beli ini, tp mikir2 lg bingung ini atau iphone 15 pro yaa?? Recomin dong",negative,2024-11-09 07:33:36+00:00,1,Galaxy S24 Ultra,Samsung,Flagship,18-Jan-24,setia samsung a51 kemarin beli memikir bingung iphone 15 profesional ya recomin
@BangGian05,2612,Dan akhirnya s23 series sudah bisa apa yg di buat s24 series ,neutral,2024-10-27 05:43:57+00:00,1,Galaxy S24 Ultra,Samsung,Flagship,18-Jan-24,s23 series s24
@RonyBoss-k3m,2613,Masih stay di s22 U¢,neutral,2024-09-03 10:12:23+00:00,1,Galaxy S24 Ultra,Samsung,Flagship,18-Jan-24,stay s22
@gilangakbarmauludnugraha8830,2614,"Bisa 7 Tahun nya kurang satu lg bang,, ""dari Harga 21jt, jd Harga 4jt"".. ",negative,2024-08-27 14:41:48+00:00,1,Galaxy S24 Ultra,Samsung,Flagship,18-Jan-24,7 nya bang dari harga 21jt 4jt
@Alamsemesta2027,2615,nunggu harga turun jadi separo harga baru membelinya...,negative,2024-08-25 11:12:36+00:00,1,Galaxy S24 Ultra,Samsung,Flagship,18-Jan-24,menunggu harga turun separuh baru membelinya
@Ardhan-zw7fk,2616,"""S24 Ultra ini nyaris sempurna, namun ada 1 kekurangan yang ga bisa ditolerir.. Yaitu masih mikir-mikir buat beli karena harganya pricy""",positive,2024-08-24 06:43:03+00:00,1,Galaxy S24 Ultra,Samsung,Flagship,18-Jan-24,s24 ultra sempurna 1 kekurangan tidak ditoleransi pikir beli harganya pricy
@A31k93sea,2617,"Ini gimana cara agar hasil photo 50 atau 200 mp tidak berubah otomatis ya? Kadang hasil aslinya udah bagus, tba2 ada auto update brightness nya. Jadi jelek.. gedek banget",negative,2024-08-23 13:42:41+00:00,1,Galaxy S24 Ultra,Samsung,Flagship,18-Jan-24,hasil photo 50 200 mp tidak berubah otomatis iya kadang aslinya bagus tba2 auto pembaruan brightness nya jelek gedek banget
@taufiqsatriawandisonsapan4633,2618,Beli seken nya dimana dah,positive,2024-08-22 07:30:20+00:00,1,Galaxy S24 Ultra,Samsung,Flagship,18-Jan-24,beli seken nya dimana
@yoongi-j7i,2619,"sy baru move on dari iphone dan beralih ke s24 ultra,and there is avaliable for indonesia translate",neutral,2024-10-14 08:26:25+00:00,1,Galaxy S24 Ultra,Samsung,Flagship,18-Jan-24,baru pindah on dari iphone beralih s24 ultra and there is avaliable for indonesia translate
@HappyFan-h4n,2620,IP 15 pro max pun kalah,negative,2024-09-01 15:27:17+00:00,1,Galaxy S24 Ultra,Samsung,Flagship,18-Jan-24,ip 15 profesional max kalah
@DinoSakana,2621,"Hpku dulu S7 note FE, skrg udh s24 ultra. Ã¢ÂÂ¤",neutral,2024-08-24 23:05:55+00:00,1,Galaxy S24 Ultra,Samsung,Flagship,18-Jan-24,hpku s7 note fe s24 ultra ã â
@vinicikowyukira,2622,Wah Mantapp nih ÂÂÂÂ»,positive,2024-08-16 09:47:23+00:00,1,Galaxy S24 Ultra,Samsung,Flagship,18-Jan-24,mantap â
@zzzzzzzzzzzzzzzzzzzzzzzz4760,2623,Klw masuk indo 3 bulan lagi mending ambil iqoo z7 atau z8?,negative,2023-09-21 10:17:32+00:00,1,iQOO Z8,iQOO,Mid-Range,24-Aug,masuk indonesia 3 ambil iqoo z7 z8
@akungaming9758,2624,Beneran min masuk indo?,negative,2023-09-06 13:44:40+00:00,1,iQOO Z8,iQOO,Mid-Range,24-Aug,benaran min masuk indonesia
@Debisadri24.12,2625,"Masuk indo dah lah slesai tu Xiomi, Relme, infinix",neutral,2023-09-05 02:02:55+00:00,1,iQOO Z8,iQOO,Mid-Range,24-Aug,masuk indonesia selesai xiomi relme infinix
@ModHunters,2626,"2:03 kebiasaan vivo yang udh turun temurun, lensa tambahan buat menarik aja tapi gak berguna sama sekali 8:22 untuk vivo yang menjadi keunggulannya yaitu cooling sistem yang tahan panas bahkan biarpun pakai chipset galak seperti dimensity 9000an kalo dipegang vivo udh nurut aja itu chipset",positive,2024-11-09 15:55:02+00:00,1,Vivo X100 Pro,Vivo,Flagship,2024,2 03 kebiasaan vivo turun temurun lensa tambahan menarik tapi tidak berguna sama 8 22 keunggulannya cooling sistem tahan panas biarpun pakai chipset galak dimensity 9000an dipegang
@RsyaaGT,2627,mau nanya nih mending vivo x100 pro atau xiaomi 14t pro?,neutral,2024-11-05 07:22:19+00:00,1,Vivo X100 Pro,Vivo,Flagship,2024,vivo x100 profesional xiaomi 14t
@wyyizi,2628,Speknya sudah dewa sekali tp sama aja tinggal d indo sebagus apapun dan semahal apaoun tetap aja di bandingin dengan iphone kwkwkw,negative,2024-08-27 14:15:53+00:00,1,Vivo X100 Pro,Vivo,Flagship,2024,speknya dewa sama tinggal indonesia sebagus apapun semahal bandingkan iphone wkwk
@jo_vlog,2629,Buat you tuber bagus vivo x 100 pro atau iphone 13 bg,positive,2024-08-17 18:27:12+00:00,1,Vivo X100 Pro,Vivo,Flagship,2024,tuber bagus vivo x 100 profesional iphone 13 bagi
@kevinjuan9493,2630,Gila udh setahun sejak launching gw masih blm nemu yg lebih ok dari X100 pro yg masuk indo  Samsung Iphone ga niat ngeluarin produk cuma tambahin Artificial Intelligence lucu-lucuan. Kayaknya pesaing terdekat cuma Xiaomi tapi overall masih menang X100 pro sih kl gw,positive,2024-10-07 02:55:27+00:00,1,Vivo X100 Pro,Vivo,Flagship,2024,gila setahun launching gue belum menemukan oke dari x100 profesional masuk indonesia samsung iphone tidak niat mengeluarkan produk tambahkan artificial intelligence lucu lucuan kayaknya pesaing terdekat xiaomi tapi overall menang sih
@TriExynos,2631,okey ayo nabung buat vivo ini­,positive,2024-08-21 13:22:18+00:00,1,Vivo X100 Pro,Vivo,Flagship,2024,okey ayo menabung vivo
@iksyasyarif,2632,Ha0r gil4.. semoga gua bisa beli..,negative,2024-08-06 11:51:11+00:00,1,Vivo X100 Pro,Vivo,Flagship,2024,ha0r gil4 semoga gue beli
@iyus_sugirman,2633,"""Sebagai user Android dan I phone, awal2 mau beli HP vivo di bilangin ama istri.. Jangan beli brand yg gk jelas. Eh akhirnya berani buat coba. Sebenernya hp vivo bagus. Tpi yg kalian beli seri apa dlu. Jgnkan seri x ya, hp vivo v27 saya aja di adu ama ip 13 istri saya .. Bagusan kamera vivo jauh.. Ampe pas fto2. Blg bagusan pake ini. Ampe nanya ini hp apa emg bgtu.. Jd gk enak ama bini wkwkwk""",positive,2024-07-22 14:03:48+00:00,1,Vivo X100 Pro,Vivo,Flagship,2024,pengguna android i phone beli handphone vivo bilang sama istri merek tidak eh berani coba bagus seri x iya v27 adu ip 13 bagusan kamera pa foto pakai enak bini wkwk
@Jazzy2020-xe4em,2634,edannn vivoÂÂÂ¥,negative,2024-07-15 20:25:13+00:00,1,Vivo X100 Pro,Vivo,Flagship,2024,edan vivoâ â
@jipro7361,2635,"saya beli hp selalu lihat review dulu trutama gadjet in.. tpi kenyataan rekaman video tak, sesuai expetasi dan review ÂÂ¤Â£ÂÂ¤Â£ rekaman patah2.. redmi note 12 . dan kenapa ya aplikasi selalu nutup sdri",negative,2024-11-15 15:25:36+00:00,1,Redmi Note 13 5G,Xiaomi,Mid-Range,24-Feb,beli handphone lihat review gadjet in kenyataan rekaman video tidak sesuai expetasi â patah2 redmi note 12 iya aplikasi menutup saudari
@ghanimusic_indo,2636,"Kekurangan nya mnurut gw speaker mono & rekaman blm 60fps, alhamdulillah udh kebeli hp ini, layar cakep",positive,2024-10-21 00:21:48+00:00,1,Redmi Note 13 5G,Xiaomi,Mid-Range,24-Feb,kekurangan nya gue speaker mono rekaman belum 60fps alhamdulillah kebeli handphone layar cakap
@AryaSyamnoer22,2637,"jangan beli renot 13 5g sumpah co gw baru 1 bulan pake udah panas pake maen game, sama kalo rekam vidio patah"" bangettt mending beli samsung aja rekomendasi nya",negative,2024-10-05 12:08:07+00:00,1,Redmi Note 13 5G,Xiaomi,Mid-Range,24-Feb,beli renot 13 5g sumpah co gue baru 1 pakai panas main game sama rekam video patah banget samsung rekomendasi nya
@andikapradana6161,2638,Entah kenapa redmi paling oke mentok di redminot 10 pro ¢,positive,2024-09-17 17:34:57+00:00,1,Redmi Note 13 5G,Xiaomi,Mid-Range,24-Feb,redmi oke mentok redminot 10 profesional
@muhammadarsyad5302,2639,"Bagusan yang mana, redmi note 13 5g atau poco m6 pro untuk kamera dan gameplaynya juga,tapi aku gak terlalu main game sih. tolong sarannyaÂÂÂ",negative,2024-11-10 12:34:27+00:00,1,Redmi Note 13 5G,Xiaomi,Mid-Range,24-Feb,bagusan redmi note 13 5g poco m6 profesional kamera gameplaynya tapi tidak main game sih tolong sarannyaâ â
@ledianaayu4034,2640,plissss mnding redmi note 13 5g sama smsung a33 5g mnding mana?,negative,2024-10-10 14:41:12+00:00,1,Redmi Note 13 5G,Xiaomi,Mid-Range,24-Feb,plissss redmi note 13 5g sama smsung a33
@RiskySuciawan,2641,Apa udah dapet temper glass bawaan?,neutral,2024-09-21 08:16:54+00:00,1,Redmi Note 13 5G,Xiaomi,Mid-Range,24-Feb,temper glass bawaan
@brokaplodan,2642,"Sebelum liat review ini gk ada niatan buat gantiin poco x3 NFC yg udh nemenin 3 than ini, skrg malah jadi mikir2... ",negative,2024-09-20 15:25:04+00:00,1,Redmi Note 13 5G,Xiaomi,Mid-Range,24-Feb,lihat review tidak niatan gantikan poco x3 nfc menemani 3 tahan memikir
@monyetkurap9009,2643,5G with mono speaker is much better than 4G with stereo speakers.,positive,2024-09-14 00:13:30+00:00,1,Redmi Note 13 5G,Xiaomi,Mid-Range,24-Feb,5g mono speaker is much better tahan 4g stereo
@frdy-q3k,2644,Bagusan mana bng samsung m15 5 G apa redmi note 13 5G tolong di jawab ya bng,neutral,2024-09-12 18:59:11+00:00,1,Redmi Note 13 5G,Xiaomi,Mid-Range,24-Feb,bagusan bang samsung m15 5 tidak redmi note 13 5g tolong iya
@lifewithpoem9386,2645,Huengggg. Rencana pen beli yang 4g ¢,negative,2024-09-10 04:17:25+00:00,1,Redmi Note 13 5G,Xiaomi,Mid-Range,24-Feb,huengggg rencana beli 4g
@muhamadjefri25,2646,Baru beli tadi sore redmi not 13 5G 8/256..semoga awet ÂÂÂ,positive,2024-11-15 15:17:46+00:00,1,Redmi Note 13 5G,Xiaomi,Mid-Range,24-Feb,baru beli sore redmi not 13 5g 8 256 semoga awet â
@yonkouniel2307,2647,Akhirnya udah kebeli ni HP,neutral,2024-10-17 09:28:54+00:00,1,Redmi Note 13 5G,Xiaomi,Mid-Range,24-Feb,kebeli nih handphone
@drangding8941,2648,Udah turun harganya kita buy,negative,2024-10-14 11:39:54+00:00,1,Redmi Note 13 5G,Xiaomi,Mid-Range,24-Feb,turun harganya buy
@m.kilat7816,2649,"Allhamdulillah juga udah kebeli renot 13 5g udah seminggu , semoga yg belum bisa ganti hp dilancarin rejekinya biar bisa beli hp baru aamiin",neutral,2024-10-08 21:22:07+00:00,1,Redmi Note 13 5G,Xiaomi,Mid-Range,24-Feb,allhamdulillah kebeli renot 13 5g seminggu semoga belum ganti handphone dilancarin rejekinya biar beli baru amin
@bangden0467,2650,Alhamdulillah Sudah KebeliÂÂ¥Â°,negative,2024-09-27 03:18:20+00:00,1,Redmi Note 13 5G,Xiaomi,Mid-Range,24-Feb,alhamdulillah kebeliâ â
@SandiPutra06,2651,Alhamdulillah dari nonton akhirnya bisa kebeli ni hp,positive,2024-09-23 08:15:29+00:00,1,Redmi Note 13 5G,Xiaomi,Mid-Range,24-Feb,alhamdulillah dari menonton kebeli nih handphone
@riana7648,2652,setiap mau beli hp pasti cek review disini dulu ÂÂ¤Â­,neutral,2024-09-18 05:53:56+00:00,1,Redmi Note 13 5G,Xiaomi,Mid-Range,24-Feb,beli handphone cek review â
@sendimutaridin405,2653,"Akhirnya dapet juga yg warna putih , cantik banget, nyaman di pake ngetik dan sosmed",positive,2024-09-09 18:56:34+00:00,1,Redmi Note 13 5G,Xiaomi,Mid-Range,24-Feb,warna putih cantik banget nyaman pakai mengetik medium sosial
@pandetoriez7306,2654,"Aku pribadi mencinta hp redmi, tpi pas beli hp ini nysel hp mudah panas apalagi pas main game, gak rekomen banget",negative,2024-10-14 09:54:03+00:00,1,Redmi Note 13 Pro 5G,Xiaomi,Mid-Range,24-Feb,pribadi mencinta handphone redmi pa beli nysel mudah panas main game tidak rekomen banget
@rnsptwan3826,2655,"Ga murah , karena ada iklan yg ga ada matinya",positive,2024-10-13 03:54:45+00:00,1,Redmi Note 13 Pro 5G,Xiaomi,Mid-Range,24-Feb,tidak murah iklan matinya
@csya4040,2656,Bang david tolong banget.. Saya beli HP baru xiomi redmi note 13 pro 5g. Tapi batre nyaa boros bngettt.. Cara komplennya gimna bang?? Tolong bang bantuinÂÂÂÂÂÂ,negative,2024-09-28 06:13:00+00:00,1,Redmi Note 13 Pro 5G,Xiaomi,Mid-Range,24-Feb,bang david tolong banget beli handphone baru xiomi redmi note 13 profesional 5g tapi baterai nya boros komplennya bantuinâ â
@rahmadkhanafi2125,2657,Banyak Iklan sm download otomatis apk yg ga' jelas gitu ga' Bang ??,negative,2024-09-26 00:56:51+00:00,1,Redmi Note 13 Pro 5G,Xiaomi,Mid-Range,24-Feb,iklan sama unduh otomatis ga ' bang
@september6382,2658,bagusan mana iphone 13 seken atau redmi note 13 pro 5g,neutral,2024-11-03 11:53:22+00:00,1,Redmi Note 13 Pro 5G,Xiaomi,Mid-Range,24-Feb,bagusan iphone 13 seken redmi note profesional 5g
@maxsutopo5740,2659,ini kalo saya pake selama 5/4 thun awet ga,negative,2024-10-30 04:52:02+00:00,1,Redmi Note 13 Pro 5G,Xiaomi,Mid-Range,24-Feb,pakai 5 4 awet tidak
@afizchapermana7380,2660,Ini sama vivo v30 atau v40 bagus mana yaa,positive,2024-10-25 12:18:21+00:00,1,Redmi Note 13 Pro 5G,Xiaomi,Mid-Range,24-Feb,sama vivo v30 v40 bagus ya
@DimasYouga,2661,Flare hijau ( titik ) di kamera redmi note 13 pro 5G saat kena cahaya / lampu itu normal gak sih...??,neutral,2024-10-21 10:08:32+00:00,1,Redmi Note 13 Pro 5G,Xiaomi,Mid-Range,24-Feb,flare hijau titik kamera redmi note 13 profesional 5g kena cahaya lampu normal tidak sih
@pembelakebenaran.3105,2662,"Mau nanya, apakah redmi 13 pro 5g sudah ada dual camera??",neutral,2024-10-02 13:06:12+00:00,1,Redmi Note 13 Pro 5G,Xiaomi,Mid-Range,24-Feb,redmi 13 profesional 5g dual camera
@syz8054,2663,Bagusan remot 13 pro 5g atau Xiaomi 13T ?,neutral,2024-09-28 22:52:37+00:00,1,Redmi Note 13 Pro 5G,Xiaomi,Mid-Range,24-Feb,bagusan remot 13 profesional 5g xiaomi 13t
@inidiksaan,2664,"Aku pake redmi note 9 udah 3 thn lebih masih oke oke aja, masih lancar no ngelag, buat maen game favorit ff sama ml lancar jaya, cuma pernah ga sengaja kemasukan air lewat bawah, jadi mati idup mati idup, tapi ganti batre jadi normal lagi, lancar gada masalah. Jadi menurutku xiaomi paling top lah soal kualitas, biar dibilang HP murahan, tapi aku lebih bangga pake xiaomi ketimbang vivo oppo infinix atau sejenisnya. Kalopun mau beli HP baru pasti yg pertama ku tengok xiaomi dulu, mereka punya HP apa di budget yg ku punya. Mantablah xiaomi, dari dulu selalu puas sama produknya",positive,2024-11-14 05:43:51+00:00,1,Redmi Note 13 Pro 5G,Xiaomi,Mid-Range,24-Feb,pakai redmi note 9 3 oke lancar no ngelag main game favorit fan fiction sama ml jaya tidak sengaja kemasukan air mati hidup tapi ganti baterai normal masalah menurutku xiaomi top kualitas biar dibilang handphone murahan bangga ketimbang vivo oppo infinix sejenisnya beli baru ku menjenguk budget mantablah dari puas produknya
@dewaayusastrani7731,2665,6 nov 2024. Ak bsa bli hp ini,neutral,2024-11-06 15:11:38+00:00,1,Redmi Note 13 Pro 5G,Xiaomi,Mid-Range,24-Feb,6 november 2024 beli handphone
@zay998zay8,2666,gue baru beli??,negative,2024-10-30 02:48:35+00:00,1,Redmi Note 13 Pro 5G,Xiaomi,Mid-Range,24-Feb,baru beli
@jejeskoki1521,2667,Aku yg pakek redmi 5plus dari 2019 soal kamera emang bagus sih redmi,positive,2024-10-26 22:58:25+00:00,1,Redmi Note 13 Pro 5G,Xiaomi,Mid-Range,24-Feb,pakai redmi 5plus dari 2019 kamera bagus sih
@arthawiguna7543,2668,"ini lgi make redmi note 13 pro, tapi minusnya lumayan boros tapi overall mantap bgtt",positive,2024-10-26 06:03:18+00:00,1,Redmi Note 13 Pro 5G,Xiaomi,Mid-Range,24-Feb,make redmi note 13 profesional tapi minusnya lumayan boros overall mantap banget
@raykalhakim4806,2669,Bismillah bulan depan dpt hp ini,negative,2024-10-20 19:48:14+00:00,1,Redmi Note 13 Pro 5G,Xiaomi,Mid-Range,24-Feb,bismillah handphone
@Riesh17,2670,semoga kebeli bulan depan,positive,2024-10-19 11:56:49+00:00,1,Redmi Note 13 Pro 5G,Xiaomi,Mid-Range,24-Feb,semoga kebeli
@RendySetiyanto,2671,Gua pake Xiomi 13pro5G adu sama Iphone 11 masih menang tipis bg beda 3detik emang kelaz ini hp ,negative,2024-10-17 21:31:28+00:00,1,Redmi Note 13 Pro 5G,Xiaomi,Mid-Range,24-Feb,gue pakai xiomi 13pro5g adu sama iphone 11 menang tipi bagi beda 3detik kelaz handphone
@Sandioktaria-n3u,2672,"Aku yang nonton pakek redmi note 13 pro 5G, senyum2 sendiri",neutral,2024-10-12 05:23:15+00:00,1,Redmi Note 13 Pro 5G,Xiaomi,Mid-Range,24-Feb,menonton pakai redmi note 13 profesional 5g senyum
@MCSBANJARMASIN,2673,"alhamdulillah karena redmi note 8 pro mulai hang2, akhirnya beli redmi note 13 pro 5G......dan udah update ke Hyper OS dpt android 14",positive,2024-10-08 02:55:47+00:00,1,Redmi Note 13 Pro 5G,Xiaomi,Mid-Range,24-Feb,alhamdulillah redmi note 8 profesional hang2 beli 13 5g pembaruan hyper o android 14
@IchalDeulofeu,2674,Alhamdulillah semenjak liat vidio ini jadi tambah yakin buat pake renot 13 pro 5G dan alhamdulillah baru kesampean dari awal bang David buat vidio,positive,2024-10-07 16:09:49+00:00,1,Redmi Note 13 Pro 5G,Xiaomi,Mid-Range,24-Feb,alhamdulillah semenjak lihat video pakai renot 13 profesional 5g baru dari bang david
@tedi9559,2675,"Sayang bump camera nya tebel bgt, lebar, harusnya kaya yang 11 pro plus.. Yang 11 pro udah cakep, bump juga ga terlalu tebel, Masih elegan vivo v30 emang, cuma sayang mono speaker aja",positive,2024-08-20 08:23:44+00:00,1,Realme 12 Pro 5G,Realme,Mid-Range,24-Feb,sayang bump camera nya tebal banget lebar kayak 11 profesional plus cakap tidak elegan vivo v30 mono speaker
@cipluxgendeng9558,2676,Terlalu cepat utk memilih Xiomai 13T....,negative,2024-05-02 03:32:53+00:00,1,Realme 12 Pro 5G,Realme,Mid-Range,24-Feb,cepat memilih xiomai 13t
@BroSawer,2677,"""Review setelah 2 minggu Kamera : tele memuaskan, portrait ok, makro kurang halus Gaming : undawn, hasil nya? skip Multitasking : lag, dari ML switch ke WA, switch ke Excel Hasil : Tanggung""",negative,2024-04-12 11:27:26+00:00,1,Realme 12 Pro 5G,Realme,Mid-Range,24-Feb,review 2 minggu kamera tele memuaskan portrait oke makro halus gaming undawn hasil nya skip multitasking lag dari ml switch wa excel tanggung
@jibranhanif,2678,Kamera telephotonya optimal di pembesaran berapa kali ya? 10x masih oke ngga?,negative,2024-07-09 10:13:30+00:00,1,Realme 12 Pro 5G,Realme,Mid-Range,24-Feb,kamera telephotonya optimal pembesaran kali iya 10x oke tidak
@kakaprayoga-nm6tl,2679,untuk yang realme 12 pro standar apa masuk indo om?,negative,2024-07-03 07:40:37+00:00,1,Realme 12 Pro 5G,Realme,Mid-Range,24-Feb,realme 12 profesional standar masuk indonesia om
@nurditachannel5135,2680,"""Mau tanya mending realme 12 pro atau IP 11?""",negative,2024-04-07 15:03:54+00:00,1,Realme 12 Pro 5G,Realme,Mid-Range,24-Feb,realme 12 profesional ip 11
@JDK.Channel,2681,"""syukurlah skrg realme tuningan warna nya gk lebayy... jgn bandingin sama kamera burik punya poco x6 pro yg pke sensor omnivision ov64b burikk""",negative,2024-04-29 08:47:27+00:00,1,Realme 12 Pro 5G,Realme,Mid-Range,24-Feb,syukurlah realme tuningan warna nya tidak lebay bandingkan sama kamera burik poco x6 profesional pakai sensor omnivision ov64b burikk
@Fadli_1606.,2682,Realme the best.,positive,2024-04-15 01:28:37+00:00,1,Realme 12 Pro 5G,Realme,Mid-Range,24-Feb,realme the best
@Ramasevilla25,2683,3 kali nonton ini di ulang2 . Akhirnya fix ambil redmi,neutral,2024-07-12 04:01:05+00:00,1,Infinix Zero 30,Infinix,Mid-Range,24-Aug,3 kali menonton ulang fix ambil redmi
@revarespiyanti4407,2684,Tolong dong mending infinix zero 30 apa redmi 12,neutral,2024-07-09 14:46:47+00:00,1,Infinix Zero 30,Infinix,Mid-Range,24-Aug,tolong infinix zero 30 redmi 12
@ibrahimabdillah4271,2685,Mending ini atau note 40 y?,negative,2024-06-27 12:56:30+00:00,1,Infinix Zero 30,Infinix,Mid-Range,24-Aug,note 40 iya
@zidanramadhan5831,2686,Zero 30 vs note 40 bagus mana ya? mau beli bingung,negative,2024-03-24 04:23:14+00:00,1,Infinix Zero 30,Infinix,Mid-Range,24-Aug,zero 30 lawan note 40 bagus iya beli bingung
@nurmuslimin3044,2687,Ini udah ada sensor sidik jarinya gak sih kak ???,neutral,2024-03-17 07:51:03+00:00,1,Infinix Zero 30,Infinix,Mid-Range,24-Aug,sensor sidik jarinya tidak sih kak
@kenchannel383,2688,sebenarnya tergoda saya bang tpi kira2 awet gak ya bang untuk pakaian jangka panjang...ya buat harian aja...dan game pun jarang2 ...dan adakah keluhan di kekuatan sinyal...di daerah yg jauh dri tower...,negative,2024-10-17 10:51:31+00:00,1,Infinix Zero 30,Infinix,Mid-Range,24-Aug,tergoda bang awet tidak iya pakaian jangka harian game jarang2 adakah keluhan kekuatan sinyal daerah dari tower
@FarizSetiawan-h8w,2689,Bang bisa d upgrade android 14 gx,neutral,2024-09-23 16:07:59+00:00,1,Infinix Zero 30,Infinix,Mid-Range,24-Aug,bang peningkatan android 14 tidak
@cecepgorbachev3018,2690,Dibongkar semua rahasia hp branded sama infinix ,negative,2024-08-19 00:18:07+00:00,1,Infinix Zero 30,Infinix,Mid-Range,24-Aug,dibongkar rahasia handphone bermerek sama infinix
@asmarofficiall,2691,baru beli harga plash 7.7 sisa 2.5jt dapat cashback 2rts rb sisa 2.3 dapat potongan tiktok 2rts saua bayar sisa 1.150jt...OP bangat hp nya yg warna green ,positive,2024-07-07 08:36:13+00:00,1,Infinix Zero 30,Infinix,Mid-Range,24-Aug,baru beli harga plash 7 sisa 2 5jt cashback 2rts ribu 3 potongan tiktok saua bayar 1 150jt op banget handphone nya warna green
@adityaadjie591,2692,"Udh berapa kali ngulangin video unboxsing zero 30 4g bang David ,akhir nya fix beli ni hp zero 30 4g walaupun ada yg terbaru note 40 dengan harga yg sama saya lebih milih zero 30 4g terbaik",positive,2024-07-04 16:59:30+00:00,1,Infinix Zero 30,Infinix,Mid-Range,24-Aug,kali mengulangi video unboxsing zero 30 4g bang david nya fix beli nih handphone terbaru note 40 harga sama memilih terbaik
@AriefYuli-v5n,2693,"2024 baru bisa beli HP ini, alhamdulillah",positive,2024-07-01 15:46:10+00:00,1,Infinix Zero 30,Infinix,Mid-Range,24-Aug,2024 baru beli handphone alhamdulillah
@sherlycious5790,2694,Bismillah mau beli­,positive,2024-06-16 17:02:47+00:00,1,Infinix Zero 30,Infinix,Mid-Range,24-Aug,bismillah beli
@fiyahdiana,2695,Zero 30 5G dong bang,positive,2024-05-01 17:38:21+00:00,1,Infinix Zero 30,Infinix,Mid-Range,24-Aug,zero 30 5g bang
@hunterrevew94,2696,Zero 30 5G jauh lebih enak bang,positive,2024-04-22 11:43:25+00:00,1,Infinix Zero 30,Infinix,Mid-Range,24-Aug,zero 30 5g enak bang
@langvoldigoad.5397,2697,untuk hp ini bisa ga sih 120fps mobile legend yg tau tutornyaÂÂÂ,neutral,2024-03-30 12:44:50+00:00,1,Infinix Zero 30,Infinix,Mid-Range,24-Aug,handphone tidak sih 120fps mobile legend tutornyaâ â
@almakruf4131,2698,Gara gara ini saya beli pas HP yang dulu rusak juga kemakan usia,negative,2024-03-24 15:46:36+00:00,1,Infinix Zero 30,Infinix,Mid-Range,24-Aug,gara beli pa handphone rusak termakan usia
@ridwanjuniorr,2699,"""Mending ini/samsung a55 5g? Harganya kan sama""",negative,2024-11-01 06:11:29+00:00,1,Vivo V40,Vivo,Mid-Range,24-Aug,samsung a55 5g harganya sama
@paizalrifqiw,2700,"masih bingung cuy,antara vivo v40/samsung a55 :)",neutral,2024-10-20 15:05:49+00:00,1,Vivo V40,Vivo,Mid-Range,24-Aug,bingung coy vivo v40 samsung a55
@mugenmugen9937,2701,Beli sekarang apa nunggu keluaran terbaru ya arghh bingung,negative,2024-10-10 07:22:28+00:00,1,Vivo V40,Vivo,Mid-Range,24-Aug,beli menunggu keluaran terbaru iya arghh bingung
@amandaputri3737,2702,kesini krn bingung mau ganti hp lanjut vivo user apa samsung¢,neutral,2024-10-06 00:12:49+00:00,1,Vivo V40,Vivo,Mid-Range,24-Aug,kesini bingung ganti handphone vivo pengguna samsung
