author,id,comment,sentiment,timestamp,like_count,tipe_produk,brand,segment,release_date,text_processed
@chanlyna2528,1649,Ultra sangat bagus ??,positive,2024-05-22 09:39:08+00:00,0,Huawei Pura 70 Ultra,Huawei,Flagship,18-Apr-24,ultra bagus
@ArsenBotman,1650,eSIM?,negative,2024-05-15 13:52:32+00:00,0,Huawei Pura 70,Huawei,Flagship,18-Apr-24,esim
@kamalsubba1637,1651,Ini ponsel yang sangat luar biasa!,negative,2024-05-06 00:58:43+00:00,0,Huawei Pura 70,Huawei,Flagship,18-Apr-24,ponsel
@iqbalpreneur,1652,"Lah dr susunan kameranya
Gk make sensor 1 inch nih ?",negative,2024-10-27 12:46:16+00:00,0,Galaxy S25 Ultra,Samsung,Flagship,5-Jan-25,dari susunan kameranya tidak make sensor 1 inch
@ProfessionalMocker,1653,iPhone destroyer is coming,neutral,2024-10-15 07:15:23+00:00,0,Galaxy S25 Ultra,Samsung,Flagship,5-Jan-25,iphone destroyer is coming
@BintangBintang-y4l,1654,Kluar tiap th tp g ad beda yg signifikan dr S sblm2nya,neutral,2024-10-13 14:52:19+00:00,0,Galaxy S25 Ultra,Samsung,Flagship,5-Jan-25,tidak beda signifikan dari si sblm2nya
@rynryn277,1655,Layar lengkungnya udah ga ada apa min?,negative,2024-10-09 12:54:16+00:00,0,Galaxy S25 Ultra,Samsung,Flagship,5-Jan-25,layar lengkungnya tidak min
@Tjah358,1656,Mantap nih.. desainya..,positive,2024-10-07 15:42:07+00:00,0,Galaxy S25 Ultra,Samsung,Flagship,5-Jan-25,mantap desainya
@erwingideon8198,1657,"Selama Layar LENGKUNG nya di hilangkan seperti s24 Ultra Maka TETAP KURANG LAKU ????
second nya saja masih mahal s23 ultra daripada s24 ultra.
Karena s23 ultra msh melengkung",negative,2024-10-06 02:02:20+00:00,0,Galaxy S25 Ultra,Samsung,Flagship,5-Jan-25,layar lengkung nya hilangkan s24 ultra laku second mahal s23 melengkung
@viralbangetindo,1658,Tebal dan berat seperti batu bata,positive,2024-09-29 09:35:15+00:00,0,Galaxy S25 Ultra,Samsung,Flagship,5-Jan-25,tebal berat batu bata
@asaltau8837,1659,"Nah malah pake layar flat/datar . udah bosen kah pake layar lengkung ? makanya banyak brand China yg pake layar lengkung sekarang ?

tapi bagus sih ini feel premium dapet , feel Compact dapat. tapi ,,, kayak hp Sony ?",negative,2024-09-28 12:42:56+00:00,0,Galaxy S25 Ultra,Samsung,Flagship,5-Jan-25,pakai layar flat datar bosan kah lengkung merek cina tapi bagus sih feel premium compact kayak handphone sony
@WarkopAsik,1660,"Sayang banget kalo sampe desain kotak tegasnya hilang,",negative,2024-09-28 09:25:07+00:00,0,Galaxy S25 Ultra,Samsung,Flagship,5-Jan-25,sayang banget desain kotak hilang
@andikarachman16,1661,"Sebetulnya secara dimensi dan desain bentuk yg s24 Ultra saat ini udah oke kok, mungkin s25 Ultra bisa kasih pembeda kyk di layout kamera atau upgrade spek aja",neutral,2024-09-25 14:20:31+00:00,0,Galaxy S25 Ultra,Samsung,Flagship,5-Jan-25,dimensi desain bentuk s24 ultra oke s25 kasih pembeda kayak layout kamera peningkatan spesifikasi
@desraaufar,1662,Percayalah HP kalo bentuk tepi nya kotak lebih gak enak di pegang ketimbang bentuk tepi nya ada lengkungannya,negative,2024-09-24 13:39:23+00:00,0,Galaxy S25 Ultra,Samsung,Flagship,5-Jan-25,percayalah handphone bentuk tepi nya kotak tidak enak pegang ketimbang lengkungannya
@SahabatPutin,1663,rekayasanya comot punyaan xperia,negative,2024-09-24 07:12:42+00:00,0,Galaxy S25 Ultra,Samsung,Flagship,5-Jan-25,rekayasanya comot punyaan xperia
@Nakiyagamingyt,1664,Aku cuman pengen samsung kembali dengan bentuk kamera & bentuk kotaknya ?? knp skrg samsung aneh banget desain,negative,2024-09-23 22:42:01+00:00,0,Galaxy S25 Ultra,Samsung,Flagship,5-Jan-25,samsung bentuk kamera kotaknya aneh banget desain
@radenia_ap,1665,Punya layar lengkung bagus gak di pake.,negative,2024-09-23 14:26:24+00:00,0,Galaxy S25 Ultra,Samsung,Flagship,5-Jan-25,layar lengkung bagus tidak pakai
@putriportrait,1666,Kok agak mirip model A73 5G yah?! ??,negative,2024-09-23 04:16:54+00:00,0,Galaxy S25 Ultra,Samsung,Flagship,5-Jan-25,model a73 5g ya
@yunitaJ-ml7cf,1667,Layar bergaris kah ? Udh nemuin solusinya blom sih sekelas ini . Harga mahal tapi gak tahan lama pemakaian.,negative,2024-09-22 18:49:16+00:00,0,Galaxy S25 Ultra,Samsung,Flagship,5-Jan-25,layar bergaris kah menemui solusinya belum sih sekelas harga mahal tapi tidak tahan lama pemakaian
@anggersdayu9900,1668,"Bikin 6,1 inc lh yg farian ultra,,beli yg seri biasa,,gua butuh spek yg tinggi,,tapi kegedean,,gk muat di kantong",negative,2024-09-22 16:42:18+00:00,0,Galaxy S25 Ultra,Samsung,Flagship,5-Jan-25,bikin 6 1 incorporate farian ultra beli seri gue butuh spesifikasi tapi kegedean tidak muat kantong
@Amnhabakiri,1669,Lebar 72mm kayaknya paling enak deh.,positive,2024-09-22 11:30:01+00:00,0,Galaxy S25 Ultra,Samsung,Flagship,5-Jan-25,lebar 72mm kayaknya enak deh
@MILIHARR,1670,Apa kata sony mengenai ini ??.. aku suda pake design compact dr jaman... ??????,neutral,2024-09-22 06:08:48+00:00,0,Galaxy S25 Ultra,Samsung,Flagship,5-Jan-25,sony pakai design compact dari jaman
@ryanrichard4283,1671,"S24ultra aja blm lunas cicilan,uda mau keluar lagi wkwkwke",negative,2024-09-22 04:37:28+00:00,0,Galaxy S25 Ultra,Samsung,Flagship,5-Jan-25,s24ultra belum luna cicilan wkwkwke
@zandar80,1672,keren kaya hp sony ??,positive,2024-09-21 16:37:07+00:00,0,Galaxy S25 Ultra,Samsung,Flagship,5-Jan-25,keren kayak handphone sony
@ronzkyxxx,1673,Kembalikan ke bentuk mirip note 20 ultra tuh cakep,positive,2024-09-20 18:18:33+00:00,0,Galaxy S25 Ultra,Samsung,Flagship,5-Jan-25,kembalikan bentuk note 20 ultra cakap
@indradijaya-zx2ht,1674,Kembalikan bentuk S yg dlu. Ga suka dicampur2 sama note,negative,2024-09-20 12:56:14+00:00,0,Galaxy S25 Ultra,Samsung,Flagship,5-Jan-25,kembalikan bentuk si tidak suka dicampur2 sama note
@rktech5320,1675,Tidak menarik dari S20 sama aja,negative,2024-09-20 08:12:50+00:00,0,Galaxy S25 Ultra,Samsung,Flagship,5-Jan-25,tidak menarik dari s20 sama
@menggala30071981,1676,Bg horang kaya hp ini cocok dijadikan tatakan gelas champagne ??,neutral,2024-09-20 01:03:00+00:00,0,Galaxy S25 Ultra,Samsung,Flagship,5-Jan-25,bagi orang kayak handphone cocok dijadikan tatakan gelas champagne
@sintaxerror423,1678,itu kabar yg bikin sedikit gembira si.. setidak punya bentuk lah.. dr pada kotak bata..,positive,2024-09-19 16:04:22+00:00,0,Galaxy S25 Ultra,Samsung,Flagship,5-Jan-25,kabar bikin gembira sih setidak bentuk dari kotak bata
@radhikachalid,1679,Keren klo gt modelnya,positive,2024-09-19 15:26:49+00:00,0,Galaxy S25 Ultra,Samsung,Flagship,5-Jan-25,keren modelnya
@hapri236,1680,pinggiran nya cakep uy,positive,2024-09-19 14:43:08+00:00,0,Galaxy S25 Ultra,Samsung,Flagship,5-Jan-25,pinggiran nya cakap uy
@lsfaom,1681,tetap no curve ? shit,negative,2024-09-19 11:35:34+00:00,0,Galaxy S25 Ultra,Samsung,Flagship,5-Jan-25,no curve shit
@Weinen8894,1682,"Galaxy makin mirip Xperia, maksudnya apa yah",neutral,2024-09-19 11:30:56+00:00,0,Galaxy S25 Ultra,Samsung,Flagship,5-Jan-25,galaxy xperia maksudnya ya
@muhammadridzuan44,1683,Nanti bikin screen flat kawah,neutral,2024-09-19 10:12:56+00:00,0,Galaxy S25 Ultra,Samsung,Flagship,5-Jan-25,bikin screen flat kawah
@andinugr4ha,1684,"Ini samsung apa xiomi redmi note, koq sudutnya kaku gituh hahahaha",negative,2024-09-19 07:26:43+00:00,0,Galaxy S25 Ultra,Samsung,Flagship,5-Jan-25,samsung xiomi redmi note sudutnya kaku haha
@dimasjovanka5666,1685,Mirip a series,negative,2024-09-19 07:11:51+00:00,0,Galaxy S25 Ultra,Samsung,Flagship,5-Jan-25,a series
@khafidy2791,1687,"Belum kebeli s23 ultra, eh ini udh rilis lgi??",negative,2024-09-19 05:42:54+00:00,0,Galaxy S25 Ultra,Samsung,Flagship,5-Jan-25,belum kebeli s23 ultra eh rilis
@jangdegus,1688,Jirrr design nya makin tajemm??,negative,2024-09-19 05:09:13+00:00,0,Galaxy S25 Ultra,Samsung,Flagship,5-Jan-25,jirrr design nya tajemm
@Durio_zibethinus,1689,"Pengen deh hp resmi dengan form factor dari balmuda phone, hp sabun dove ??",neutral,2024-09-19 04:51:43+00:00,0,Galaxy S25 Ultra,Samsung,Flagship,5-Jan-25,deh handphone resmi borang factor dari balmuda phone sabun dove
@Reyzeldotcom,1690,Lebih suka yg sudut yg kaku sih,negative,2024-09-19 03:24:24+00:00,0,Galaxy S25 Ultra,Samsung,Flagship,5-Jan-25,suka sudut kaku sih
@awan123Surya,1691,Owww ip 17 omg??????,negative,2024-11-15 12:30:17+00:00,0,iPhone 17,Apple,Flagship,9-Sep-25,o 17 oh my god
@RoeurngRaTabS,1692,Cinta ?? begitu banyak !!! ????????,negative,2024-11-08 11:23:50+00:00,0,iPhone 17,Apple,Flagship,9-Sep-25,cinta
@aideperez9233,1693,"Mereka selalu mengganti kamera belakang, selalu sama dengan iPhone, mereka sangat murahan dan membosankan..",negative,2024-11-03 16:29:33+00:00,0,iPhone 17,Apple,Flagship,9-Sep-25,mengganti kamera sama iphone murahan membosankan
@harisharis4840,1695,Ini palsu dan prototipeÃ¯Â¿Â½ tenang saja,negative,2024-11-03 07:08:56+00:00,0,iPhone 17,Apple,Flagship,9-Sep-25,palsu prototipeã â â½ tenang
@shengxiantan-kl7ul,1696,Apakah ini nyata,negative,2024-11-03 05:26:14+00:00,0,iPhone 17,Apple,Flagship,9-Sep-25,nyata
@Svoboba,1697,Apakah ini sama?,negative,2024-11-03 01:11:01+00:00,0,iPhone 17,Apple,Flagship,9-Sep-25,sama
@Snair1989,1698,Tidak mungkin ?????? Apple tidak bisa meninggalkan island sampai iPhone 20 ??,negative,2024-11-03 01:05:50+00:00,0,iPhone 17,Apple,Flagship,9-Sep-25,tidak apple meninggalkan island iphone 20
@TheGameSeekers,1699,iPhone 17 kapan? mungkin 2025.,negative,2024-11-02 23:29:18+00:00,0,iPhone 17,Apple,Flagship,9-Sep-25,iphone 17 2025
@Famz..,1700,Ini TIDAK.,negative,2024-11-02 13:05:07+00:00,0,iPhone 17,Apple,Flagship,9-Sep-25,tidak
@scpk7366,1701,Pasti sangat sangat sangat mahal,negative,2024-11-02 11:25:30+00:00,0,iPhone 17,Apple,Flagship,9-Sep-25,mahal
@RGV8691,1702,Ini hanya model ponsel lama... tapi spesifikasi berubah.. hanya untuk tujuan tampilan,neutral,2024-11-02 04:40:10+00:00,0,iPhone 17,Apple,Flagship,9-Sep-25,model ponsel lama tapi spesifikasi berubah tujuan tampilan
@sudarshanrock9551,1703,"Apa pun, saya akan kembali ke Android",neutral,2024-11-02 03:15:41+00:00,0,iPhone 17,Apple,Flagship,9-Sep-25,android
@MrHip4hopper,1704,Palsu... bagaimana Anda bisa mendapatkan desain sebelum diluncurkan oleh Apple?,negative,2024-11-02 03:03:31+00:00,0,iPhone 17,Apple,Flagship,9-Sep-25,palsu desain diluncurkan apple
@greg1288,1705,Jadi pada dasarnya tidak ada yang berubah kecuali lubang punch yang sudah dimiliki Android selama hampir satu dekade ??,negative,2024-11-01 20:17:18+00:00,0,iPhone 17,Apple,Flagship,9-Sep-25,dasarnya tidak berubah kecuali lubang punch dimiliki android dekade
@franksogbo6240,1706,Video ini sangat bodoh bagi saya. Video ini digunakan untuk menipu orang yang tidak tahu apa-apa tentang iPhone. Berhentilah membuat video ini atau seseorang mungkin akan menggugat kamu karena mengirimkan informasi yang salah ke publik,negative,2024-11-01 19:16:26+00:00,0,iPhone 17,Apple,Flagship,9-Sep-25,video bodoh bagi menipu orang tidak iphone berhentilah menggugat mengirimkan informasi salah publik
@munumunu363,1707,Kapan tersedia di pasar,neutral,2024-11-01 17:00:26+00:00,0,iPhone 17,Apple,Flagship,9-Sep-25,tersedia pasar
@MegaDgenx,1708,Desain konsep tidak resmi Apple sering terlihat lebih inovatif daripada rilis resmi. Akan lebih baik jika Apple menggabungkan elemen dari konsep-konsep ini daripada terus fokus pada perubahan kecil seperti desain lensa kamera. ????,positive,2024-11-01 13:31:52+00:00,0,iPhone 17,Apple,Flagship,9-Sep-25,desain konsep tidak resmi apple inovatif rilis menggabungkan elemen dari fokus perubahan lensa kamera
@Jennernonanvlogs,1709,"Iphone, adalah ponsel dengan performa terbaik, tetapi saya suka Android, opsinya,, Apple tidak punya",positive,2024-11-01 10:59:30+00:00,0,iPhone 17,Apple,Flagship,9-Sep-25,iphone ponsel performa terbaik suka android opsinya apple tidak
@ColinTam,1710,"Ponsel ini tidak murah, pembeli tidak tertarik pada iPhone lagi sekarang",negative,2024-11-01 03:22:28+00:00,0,iPhone 17,Apple,Flagship,9-Sep-25,ponsel tidak murah pembeli tertarik iphone
@ColinTam,1711,"Desainernya tertidur lagi, terlihat sama lagi, membosankan lagi",negative,2024-11-01 03:21:20+00:00,0,iPhone 17,Apple,Flagship,9-Sep-25,desainernya tertidur sama membosankan
@ColinTam,1712,"Tuhan saya, desain kamera iPhone 17 pro masih terlihat sama seperti iPhone 11, desainernya tertidur lagi? Siapa yang akan membelinya?",negative,2024-11-01 03:19:15+00:00,0,iPhone 17,Apple,Flagship,9-Sep-25,tuhan desain kamera iphone 17 profesional sama 11 desainernya tertidur membelinya
@saiyanprince8237,1713,"Jika mereka membuatnya berwarna merah, saya akan membeli dua hanya karena itu.",positive,2024-11-01 02:17:42+00:00,0,iPhone 17,Apple,Flagship,9-Sep-25,membuatnya berwarna merah membeli
@Usachatnow,1714,Tampilan keren,positive,2024-10-31 20:48:52+00:00,0,iPhone 17,Apple,Flagship,9-Sep-25,tampilan keren
@paulhill1379,1715,Tampilan bagus ??,positive,2024-10-31 15:46:11+00:00,0,iPhone 17,Apple,Flagship,9-Sep-25,tampilan bagus
@MrJaffacakes1234,1716,Awalnya saya pikir itu Samsung ??,negative,2024-10-31 15:25:36+00:00,0,iPhone 17,Apple,Flagship,9-Sep-25,pikir samsung
@diyspacecrafts,1717,Menunggu rilis pasar global ????,negative,2024-11-15 00:28:41+00:00,0,Redmi Note 14 Series,Xiaomi,Mid-Range,5-Jul,menunggu rilis pasar global
@alsanabani,1718,Perangkat ini tidak kompatibel dengan perangkat AS. Jangan beli langsung dari situs web mereka karena mereka tidak menawarkan pengembalian dan Anda tidak akan mendapatkan pengembalian dana. Ini penipuan,negative,2024-11-11 13:44:43+00:00,0,Redmi Note 14 Series,Xiaomi,Mid-Range,5-Jul,perangkat tidak kompatibel a beli langsung dari situs web menawarkan pengembalian dana penipuan
@ymnvlogs,1719,Menunggu ponsel ini ??,negative,2024-11-10 03:59:46+00:00,0,Redmi Note 14 Series,Xiaomi,Mid-Range,5-Jul,menunggu ponsel
@jamesverdida9353,1720,"Selamat Xiaomi atas peluncuran Redmi Note 14 pro dan pro plus, pembaruan besar ke tingkat tertinggi. Suka dengan faktor bentuk terbarunya, perangkat lunak dan perangkat keras terbaru dari model-model ini... ???",positive,2024-11-08 05:24:04+00:00,0,Redmi Note 14 Series,Xiaomi,Mid-Range,5-Jul,selamat xiaomi peluncuran redmi note 14 profesional plus pembaruan tingkat tertinggi suka faktor bentuk terbarunya perangkat lunak kera terbaru dari model
@RaselAlam-o5s,1721,"Tidak ???? jack audio 3,5",neutral,2024-11-06 02:18:05+00:00,0,Redmi Note 14 Series,Xiaomi,Mid-Range,5-Jul,tidak jack audio 3 5
@HeinekenLasse,1722,"Tidak ada jack headphone, tidak beli",neutral,2024-10-31 10:50:27+00:00,0,Redmi Note 14 Series,Xiaomi,Mid-Range,5-Jul,tidak jack headphone beli
@steve-lh7tp,1723,Apakah Xiaomi akan merilis mi 14lite alias 14 civi secara global? Karena ponsel ini luar biasa ??,neutral,2024-10-15 13:41:19+00:00,0,Redmi Note 14 Series,Xiaomi,Mid-Range,5-Jul,xiaomi merilis mi 14lite alias 14 civi global ponsel
@juvykentzamora3972,1724,Di mana saya bisa membeli,neutral,2024-10-14 07:21:00+00:00,0,Redmi Note 14 Series,Xiaomi,Mid-Range,5-Jul,membeli
@smoKing4freedom,1725,Baterai 6000 mAh adalah peningkatan kecil ??,negative,2024-10-13 05:19:38+00:00,0,Redmi Note 14 Series,Xiaomi,Mid-Range,5-Jul,baterai 6000 peningkatan
@kpaxx8882,1726,"Kenapa tidak ada input jack 3,5 mm? Earphone Bluetooth kualitas suara jelek dan boros energi, kenapa dihilangkan? Apple tidak harus selalu diikuti",negative,2024-10-12 20:17:30+00:00,0,Redmi Note 14 Series,Xiaomi,Mid-Range,5-Jul,tidak input jack 3 5 mm earphone bluetooth kualitas suara jelek boros energi dihilangkan apple diikuti
@sumi227,1727,"Kenapa orang membenci layar melengkung? Itu elegan, lebih sulit dibuat, terasa lebih premium di tangan, tampak tanpa bezel, lebih mudah digenggam dan sangat imersif. Redmi Note 14 Pro+ punya baterai 6400mAh? Itu benar-benar mengubah hidup",positive,2024-10-11 03:49:01+00:00,0,Redmi Note 14 Series,Xiaomi,Mid-Range,5-Jul,orang membenci layar melengkung elegan sulit premium tangan bezel mudah digenggam imersif redmi note 14 profesional baterai 6400mah mengubah hidup
@demsmongalam5449,1728,Apakah layarnya tidak terlalu melengkung?,positive,2024-10-10 12:04:01+00:00,0,Redmi Note 14 Series,Xiaomi,Mid-Range,5-Jul,layarnya tidak melengkung
@MnMPryoBanana,1729,Sejujurnya itu cantik. Sayangnya prosessornya buruk,positive,2024-10-05 13:03:05+00:00,0,Redmi Note 14 Series,Xiaomi,Mid-Range,5-Jul,sejujurnya cantik sayangnya prosessornya buruk
@muhammadfirdausabalim2038,1730,"Masih lebih baik dari Realme 13 Pro+ yang masih menggunakan Snapdragon 7s Gen 2 tapi harga dinaikkan, lol.. lebih baik beli Note 14 Pro+ ini dengan Snapdragon 7s Gen 3.. setidaknya 15 persen lebih baik performanya",positive,2024-10-02 08:47:10+00:00,0,Redmi Note 14 Series,Xiaomi,Mid-Range,5-Jul,dari realme 13 profesional snapdragon 7 gen 2 tapi harga dinaikkan wkwk beli note 14 3 15 persen performanya
@robbstarkwinterfell,1731,"Layar bagus, tapi prosessor tidak",negative,2024-10-01 17:04:03+00:00,0,Redmi Note 14 Series,Xiaomi,Mid-Range,5-Jul,layar bagus tapi prosessor tidak
@TrevorSandi,1732,Tekstur Pro terlihat mirip dengan Huawei P60 Pro,neutral,2024-10-01 11:06:40+00:00,0,Redmi Note 14 Series,Xiaomi,Mid-Range,5-Jul,tekstur profesional huawei p60
@whitelotus5538,1733,Jadi bagaimana ponsel ini lebih baik dari 13 Pro+?,negative,2024-10-01 00:05:14+00:00,0,Redmi Note 14 Series,Xiaomi,Mid-Range,5-Jul,ponsel dari 13 profesional
@fasol1998,1734,"Mereka telah menghilangkan jack audio. Dulu, ponsel Redmi Note adalah satu-satunya yang memiliki perangkat keras yang relatif decent dan jack. Sekarang mereka kehilangan itu. Headphone Bluetooth pergi ke neraka bersama ponsel tanpa jack.",negative,2024-09-29 22:48:40+00:00,0,Redmi Note 14 Series,Xiaomi,Mid-Range,5-Jul,menghilangkan jack audio ponsel redmi note satunya memiliki perangkat kera relatif decent kehilangan headphone bluetooth pergi neraka
@GabiRuta,1735,Redmi Pro Plus ini benar-benar menakjubkan. Saya akan membeli satu jika ponsel ini datang ke Eropa.,positive,2024-09-29 17:42:05+00:00,0,Redmi Note 14 Series,Xiaomi,Mid-Range,5-Jul,redmi profesional plus menakjubkan membeli ponsel eropa
@krishnasingh-jn6zz,1736,"Saudara, apakah kamu yakin mereka akan mengganti kamera mengganti kedua 50 MP ke 200 MP karena saya mengunjungi situsmu saya rasa tidak begitu ???????",negative,2024-09-29 14:22:39+00:00,0,Redmi Note 14 Series,Xiaomi,Mid-Range,5-Jul,saudara mengganti kamera 50 mp 200 mengunjungi situsmu tidak
@sivaraman7235,1737,Apakah ini punya blaster bawaan???,negative,2024-09-29 11:51:10+00:00,0,Redmi Note 14 Series,Xiaomi,Mid-Range,5-Jul,blaster bawaan
@riskyrahman534,1738,67 watt????????,negative,2024-09-29 01:26:04+00:00,0,Redmi Note 14 Series,Xiaomi,Mid-Range,5-Jul,67 watt
@leobeats47,1739,Kenapa Redmi jadi bodoh?,negative,2024-09-28 23:59:32+00:00,0,Redmi Note 14 Series,Xiaomi,Mid-Range,5-Jul,redmi bodoh
@Kiss_MyAss,1740,"Tepi melengkung adalah fitur kedua yang paling bodoh dan tidak berguna! Pilih LAYAR DATAR dan TURUNKAN HARGA untuk menguntungkan konsumen! Apa desain PALING BODOH sepanjang masa? NOTCH APPLE! ?? Notch itu tidak hanya konyol dan bodoh, itu adalah cacat desain, praktis dan fungsional! Siapa yang mau bayar lebih untuk layar besar, hanya untuk mendapatkan satu dengan notch yang menghalangi gambar, lebih parah lagi, dokumen?! Penyembah Apple yang delusional, saya kira!?? Saya rasa sebagian besar pengguna hanya akan menyembunyikan notch dalam bar hitam untuk penggunaan sehari-hari, artinya mereka melihat layar yang lebih kecil daripada yang mereka bayar! Apple belum keluar dari delusi notch mereka dengan iPhone 16! Itu menegaskan kekalahan Apple dalam kompetisi inovasi ponsel karena mereka keras kepala bertahan dengan layar kecil saat pembuat ponsel Cina memproduksi ponsel dengan layar besar namun praktis dan nyaman untuk dipegang dan digunakan!",negative,2024-09-28 21:48:30+00:00,0,Redmi Note 14 Series,Xiaomi,Mid-Range,5-Jul,tepi melengkung fitur bodoh tidak berguna pilih layar datar turunkan harga menguntungkan konsumen desain notch apple konyol cacat praktis fungsional bayar menghalangi gambar parah dokumen penyembah delusional pengguna menyembunyikan bar hitam penggunaan sehari belum dari delusi iphone 16 kekalahan kompetisi inovasi ponsel kera kepala bertahan pembuat cina memproduksi nyaman dipegang
@sergioberlusconi4840,1741,"13 Pro Plus memiliki 120w, bagaimana itu, penurunan?",neutral,2024-09-28 20:35:28+00:00,0,Redmi Note 14 Series,Xiaomi,Mid-Range,5-Jul,13 profesional plus memiliki 120w penurunan
@patrickjane880,1742,Berapa pembaruan OS?,negative,2024-09-28 17:12:30+00:00,0,Redmi Note 14 Series,Xiaomi,Mid-Range,5-Jul,pembaruan o
@ut9006,1743,Saya tidak suka layar waterfall dan desainnya! Saya lebih suka Redmi 13 Pro,negative,2024-09-28 13:04:48+00:00,0,Redmi Note 14 Series,Xiaomi,Mid-Range,5-Jul,tidak suka layar waterfall desainnya redmi 13 profesional
@MdAbdullaAlMamun-op7tl,1744,Redmi Note 14 Pro Plus Berapa kali bisa zoom?,neutral,2024-09-28 12:02:56+00:00,0,Redmi Note 14 Series,Xiaomi,Mid-Range,5-Jul,redmi note 14 profesional plus kali zoom
@SamsungA-vc7jl,1745,Saya lebih suka Nokia 1202,positive,2024-09-28 12:01:55+00:00,0,Redmi Note 14 Series,Xiaomi,Mid-Range,5-Jul,suka nokia 1202
@babekasadli,1746,TIDAK WORTH IT HARGANYA!,negative,2024-09-28 09:18:45+00:00,0,Redmi Note 14 Series,Xiaomi,Mid-Range,5-Jul,tidak worth it harganya
@CodenameD-v9n,1747,Wow mereka menghapus jack headphone. Hidup benar-benar sucks,negative,2024-09-28 08:20:57+00:00,0,Redmi Note 14 Series,Xiaomi,Mid-Range,5-Jul,menghapus jack headphone hidup suck
@leonardolingga,1748,Saya suka desain ini lebih baik daripada 14T dan 14T Pro,positive,2024-09-28 07:53:48+00:00,0,Redmi Note 14 Series,Xiaomi,Mid-Range,5-Jul,suka desain 14t profesional
@syarulramzie,1749,Desain kamera sangat jelek ??,negative,2024-09-28 06:53:29+00:00,0,Redmi Note 14 Series,Xiaomi,Mid-Range,5-Jul,desain kamera jelek
@ohahmad8443,1750,Benjolan kamera menjijikkan,negative,2024-09-28 06:12:05+00:00,0,Redmi Note 14 Series,Xiaomi,Mid-Range,5-Jul,benjolan kamera menjijikkan
@naveenbhambore,1751,Dan kisaran harga di India untuk barang ini adalah 30k+ untuk OS sampah ini dan optimisasinya ???? dan tidak ada sensor kedekatan fisik.,negative,2024-09-28 03:49:54+00:00,0,Redmi Note 14 Series,Xiaomi,Mid-Range,2025,kisaran harga india barang 30k o sampah optimisasinya tidak sensor kedekatan fisik
@amirnaim3675,1752,"Jika Pro kehilangan jack, Redmi Turbo 3 sepertinya pilihan yang lebih baik. Memiliki prosesor lebih baik, hampir sama hardware kamera, pengisian daya lebih cepat dan harganya hampir sama karena harga sedikit turun",positive,2024-09-28 03:34:51+00:00,0,Redmi Note 14 Series,Xiaomi,Mid-Range,2025,profesional kehilangan jack redmi turbo 3 pilihan memiliki prosesor sama hardware kamera pengisian daya cepat harganya harga turun
@mythsjb,1753,"Layar melengkung oke, saya tidak tahu modul kameranya tidak bagus.",negative,2024-09-28 03:27:10+00:00,0,Redmi Note 14 Series,Xiaomi,Mid-Range,2025,layar melengkung oke tidak modul kameranya bagus
@googlekullancs564,1754,Sampah.,negative,2024-09-28 01:14:53+00:00,0,Redmi Note 14 Series,Xiaomi,Mid-Range,2025,sampah
@MichaelTerry-y6r,1755,Apakah kamera 50MP lebih baik daripada kamera 108MP Note 13 atau 200MP 13 Pro? ??,negative,2024-09-28 00:59:36+00:00,0,Redmi Note 14 Series,Xiaomi,Mid-Range,2025,kamera 50mp 108mp note 13 200mp profesional
@SouravBoss08-xo1ix,1756,"Tidak ada jack headphone di kelas menengah, serius?",negative,2024-09-27 21:04:26+00:00,0,Redmi Note 14 Series,Xiaomi,Mid-Range,2025,tidak jack headphone kelas menengah serius
@RobAndrews18,1757,Saya menggunakan Redmi Note 12 Pro+. Saya tertarik dengan yang baru ini.,neutral,2024-09-27 20:47:21+00:00,0,Redmi Note 14 Series,Xiaomi,Mid-Range,2025,redmi note 12 profesional tertarik baru
@ForeverVirat18,1758,"Redmi Note 14 Pro+, peningkatan yang sangat baik. Saya suka.",positive,2024-09-27 20:34:39+00:00,0,Redmi Note 14 Series,Xiaomi,Mid-Range,2025,redmi note 14 profesional peningkatan suka
@scifiordie,1759,Spesifikasi mematikan dengan harga 260 euro semoga tidak jauh lebih mahal di EU.,negative,2024-09-27 19:27:39+00:00,0,Redmi Note 14 Series,Xiaomi,Mid-Range,2025,spesifikasi mematikan harga 260 euro semoga tidak mahal eu
@notforyou1083,1760,Apakah mereka akan dirilis secara global?,neutral,2024-09-27 17:32:38+00:00,0,Redmi Note 14 Series,Xiaomi,Mid-Range,2025,dirilis global
@fonezone8701,1761,Terlihat jelek.,negative,2024-09-27 16:44:17+00:00,0,Redmi Note 14 Series,Xiaomi,Mid-Range,2025,jelek
@Bemoon11,1762,Saya tidak sabar memiliki ponsel ini ??? Pro atau Pro+ cinta ? India.,negative,2024-09-27 16:41:02+00:00,0,Redmi Note 14 Series,Xiaomi,Mid-Range,2025,tidak sabar memiliki ponsel profesional cinta india
@gamingshift7876,1763,"Pro Plus, rangkanya logam atau plastik?",neutral,2024-09-27 15:54:11+00:00,0,Redmi Note 14 Series,Xiaomi,Mid-Range,2025,profesional plus rangkanya logam plastik
@Stes200,1764,Bisakah saya membelinya dari Yunani?,negative,2024-09-27 15:34:09+00:00,0,Redmi Note 14 Series,Xiaomi,Mid-Range,2025,membelinya dari yunani
@Bebo1265,1765,Mana yang lebih baik Xiaomi 14T atau Note 14 Pro Plus?,negative,2024-09-27 15:06:19+00:00,0,Redmi Note 14 Series,Xiaomi,Mid-Range,2025,xiaomi 14t note 14 profesional plus
@BN-bs1kj,1766,Layar melengkung.,positive,2024-09-27 14:50:44+00:00,0,Redmi Note 14 Series,Xiaomi,Mid-Range,2025,layar melengkung
@danielteye1015,1767,Pengisi daya diturunkan kualitasnya.,negative,2024-09-27 14:07:09+00:00,0,Redmi Note 14 Series,Xiaomi,Mid-Range,2025,pengisi daya diturunkan kualitasnya
@sanjivchaudhary-c5d,1768,Layar melengkung ????,negative,2024-09-27 13:55:19+00:00,0,Redmi Note 14 Series,Xiaomi,Mid-Range,2025,layar melengkung
@Othmane.FETTAKA,1769,Bingkai ini logam atau plastik?,negative,2024-09-27 13:21:06+00:00,0,Redmi Note 14 Series,Xiaomi,Mid-Range,2025,bingkai logam plastik
@searklarak,1770,Apakah Anda merekomendasikan ini daripada Iqoo Z9 Turbo+ yang juga dirilis pada waktu yang sama?,neutral,2024-09-27 13:13:25+00:00,0,Redmi Note 14 Series,Xiaomi,Mid-Range,2025,merekomendasikan iqoo z9 turbo dirilis sama
@daviddavidoff2515,1771,Honor ingin desainnya kembali ????,neutral,2024-09-27 12:22:00+00:00,0,Redmi Note 14 Series,Xiaomi,Mid-Range,2025,honor desainnya
