author;comment;sentimen;timestamp;like_count;tipe_produk;brand;segment;release_date
@awan123Surya;Owww ip 17 omg??????;positif;2024-11-15T12:30:17Z;0;iPhone 17;Apple;Flagship;September 9, 2025
@RoeurngRaTabS;Cinta ?? begitu banyak !!! ????????;positif;2024-11-08T11:23:50Z;0;iPhone 17;Apple;Flagship;September 9, 2025
@richlnacua1720;Saya suka Samsung, saya bisa merekam layar saat saya chatting dengan teman-teman saya;negatif;2024-11-05T18:40:53Z;3;iPhone 17;Apple;Flagship;September 9, 2025
@dkk2675;Hanya 17 Pro Max? 17 Pro tidak memiliki punch hole?;netral;2024-11-04T06:36:32Z;1;iPhone 17;Apple;Flagship;September 9, 2025
@Roly888T;Iphone 16 baru saja keluar dan sekarang 17? begitu cepat;netral;2024-11-03T23:16:22Z;2;iPhone 17;Apple;Flagship;September 9, 2025
@aideperez9233;Mereka selalu mengganti kamera belakang, selalu sama dengan iPhone, mereka sangat murahan dan membosankan..;negatif;2024-11-03T16:29:33Z;0;iPhone 17;Apple;Flagship;September 9, 2025
@sugenrao2101;Apa yang begitu sulit untuk menghapus punch hole dan menjadikannya kamera di layar;negatif;2024-11-03T14:00:25Z;1;iPhone 17;Apple;Flagship;September 9, 2025
@SaSa-hp1fy;Luar biasa;positif;2024-11-03T09:07:56Z;0;iPhone 17;Apple;Flagship;September 9, 2025
@harisharis4840;Ini palsu dan prototipe… tenang saja;negatif;2024-11-03T07:08:56Z;0;iPhone 17;Apple;Flagship;September 9, 2025
@shengxiantan-kl7ul;Apakah ini nyata;netral;2024-11-03T05:26:14Z;0;iPhone 17;Apple;Flagship;September 9, 2025
@bryllew3;Tidak mungkin Apple ingin terlihat seperti Android ??;negatif;2024-11-03T02:41:34Z;5;iPhone 17;Apple;Flagship;September 9, 2025
@les8947;Mereka sudah terlalu banyak berinvestasi di notch dan Dynamic Island untuk meninggalkannya begitu saja dan melakukan holepunch;negatif;2024-11-03T02:37:58Z;1;iPhone 17;Apple;Flagship;September 9, 2025
@Svoboba;Apakah ini sama?;netral;2024-11-03T01:11:01Z;0;iPhone 17;Apple;Flagship;September 9, 2025
@Snair1989;Tidak mungkin ?????? Apple tidak bisa meninggalkan island sampai iPhone 20 ??;negatif;2024-11-03T01:05:50Z;0;iPhone 17;Apple;Flagship;September 9, 2025
@TheGameSeekers;iPhone 17 kapan? mungkin 2025.;netral;2024-11-02T23:29:18Z;0;iPhone 17;Apple;Flagship;September 9, 2025
@Mr_Tommy555;Bisakah saya mengunduh apk?;netral;2024-11-02T20:49:11Z;1;iPhone 17;Apple;Flagship;September 9, 2025
@moredayzobika4147;Sejujurnya, kali berikutnya saya akan upgrade adalah iPhone 25 Pro Max, saya lelah ??;negatif;2024-11-02T18:43:17Z;1;iPhone 17;Apple;Flagship;September 9, 2025
@09_prihan;Titiknya membuatnya terlihat lebih buruk;negatif;2024-11-02T15:02:26Z;1;iPhone 17;Apple;Flagship;September 9, 2025
@Famz..;Ini TIDAK.;negatif;2024-11-02T13:05:07Z;0;iPhone 17;Apple;Flagship;September 9, 2025
@scpk7366;Pasti sangat sangat sangat mahal;negatif;2024-11-02T11:25:30Z;0;iPhone 17;Apple;Flagship;September 9, 2025
@mdimranhossain-mn9do;Dua masalah di ponsel Apple, 1 adalah MP kamera rendah dan 2 adalah kesehatan baterai;negatif;2024-11-02T05:53:39Z;3;iPhone 17;Apple;Flagship;September 9, 2025
@RedLeo-pf9yo;Setiap tahun mereka bilang akan membuat red promax dan mereka tidak pernah melakukannya;negatif;2024-11-02T05:31:52Z;12;iPhone 17;Apple;Flagship;September 9, 2025
@RGV8691;Ini hanya model ponsel lama... tapi spesifikasi berubah.. hanya untuk tujuan tampilan;negatif;2024-11-02T04:40:10Z;0;iPhone 17;Apple;Flagship;September 9, 2025
@sudarshanrock9551;Apa pun yang Android lakukan di tahun-tahun lalu, mereka lakukan hal yang sama. Mereka perlu membuat sesuatu yang lebih baik. bro Apple dulunya produsen iPhone yang hebat seperti yang digunakan untuk membawa sesuatu yang diikuti oleh semua orang, tetapi sekarang mereka membawa barang yang buruk.;negatif;2024-11-02T03:18:53Z;4;iPhone 17;Apple;Flagship;September 9, 2025
@sudarshanrock9551;Apa pun, saya akan kembali ke Android;negatif;2024-11-02T03:15:41Z;0;iPhone 17;Apple;Flagship;September 9, 2025
@MrHip4hopper;Palsu... bagaimana Anda bisa mendapatkan desain sebelum diluncurkan oleh Apple?;negatif;2024-11-02T03:03:31Z;0;iPhone 17;Apple;Flagship;September 9, 2025
@booboo9472;Itu jelek, terlihat seperti Android jelek;negatif;2024-11-02T00:46:02Z;1;iPhone 17;Apple;Flagship;September 9, 2025
@KayondoJordan-k2i;Sangat indah, kapan iPhone Edge datang;positif;2024-11-01T21:13:00Z;1;iPhone 17;Apple;Flagship;September 9, 2025
@greg1288;Jadi pada dasarnya tidak ada yang berubah kecuali lubang punch yang sudah dimiliki Android selama hampir satu dekade ??;negatif;2024-11-01T20:17:18Z;0;iPhone 17;Apple;Flagship;September 9, 2025
@TNLU_D;Mereka ingin menjadi Samsung begitu buruk ??;negatif;2024-11-01T20:12:59Z;1;iPhone 17;Apple;Flagship;September 9, 2025
@franksogbo6240;Video ini sangat bodoh bagi saya. Video ini digunakan untuk menipu orang yang tidak tahu apa-apa tentang iPhone. Berhentilah membuat video ini atau seseorang mungkin akan menggugat kamu karena mengirimkan informasi yang salah ke publik;negatif;2024-11-01T19:16:26Z;0;iPhone 17;Apple;Flagship;September 9, 2025
@munumunu363;Kapan tersedia di pasar;netral;2024-11-01T17:00:26Z;0;iPhone 17;Apple;Flagship;September 9, 2025
@poojakamble9723;Mengapa Apple tidak membuat pegangan;negatif;2024-11-01T16:28:02Z;1;iPhone 17;Apple;Flagship;September 9, 2025
@MegaDgenx;Desain konsep tidak resmi Apple sering terlihat lebih inovatif daripada rilis resmi. Akan lebih baik jika Apple menggabungkan elemen dari konsep-konsep ini daripada terus fokus pada perubahan kecil seperti desain lensa kamera. ????;negatif;2024-11-01T13:31:52Z;0;iPhone 17;Apple;Flagship;September 9, 2025
@Jennernonanvlogs;Iphone, adalah ponsel dengan performa terbaik, tetapi saya suka Android, opsinya,, Apple tidak punya;negatif;2024-11-01T10:59:30Z;0;iPhone 17;Apple;Flagship;September 9, 2025
@wadimtwana7286;Menurut saya, saya tidak tahu apakah ada sesuatu yang berbeda pada iPhone dibandingkan dengan Android;netral;2024-11-01T07:07:43Z;2;iPhone 17;Apple;Flagship;September 9, 2025
@ColinTam;Ponsel ini tidak murah, pembeli tidak tertarik pada iPhone lagi sekarang;negatif;2024-11-01T03:22:28Z;0;iPhone 17;Apple;Flagship;September 9, 2025
@ColinTam;Desainernya tertidur lagi, terlihat sama lagi, membosankan lagi;negatif;2024-11-01T03:21:20Z;0;iPhone 17;Apple;Flagship;September 9, 2025
@ColinTam;Tuhan saya, desain kamera iPhone 17 pro masih terlihat sama seperti iPhone 11, desainernya tertidur lagi? Siapa yang akan membelinya?;negatif;2024-11-01T03:19:15Z;0;iPhone 17;Apple;Flagship;September 9, 2025
@saiyanprince8237;Jika mereka membuatnya berwarna merah, saya akan membeli dua hanya karena itu.;positif;2024-11-01T02:17:42Z;0;iPhone 17;Apple;Flagship;September 9, 2025
@Usachatnow;Tampilan keren;positif;2024-10-31T20:48:52Z;0;iPhone 17;Apple;Flagship;September 9, 2025
@benjervis2538;Tidak suka kamera titik. Dynamic Island jauh lebih baik;negatif;2024-10-31T16:00:11Z;12;iPhone 17;Apple;Flagship;September 9, 2025
@paulhill1379;Tampilan bagus ??;positif;2024-10-31T15:46:11Z;0;iPhone 17;Apple;Flagship;September 9, 2025
@MrJaffacakes1234;Awalnya saya pikir itu Samsung ??;netral;2024-10-31T15:25:36Z;0;iPhone 17;Apple;Flagship;September 9, 2025
@lancelot9837;"Desain yang sama membosankan, saya tidak akan upgrade dari Apple 14 Pro Max saya, saya biasanya upgrade setiap 2 tahun, tapi iPhone tahun ini benar-benar sampah, sama seperti 17 menurut tampaknya, saya mulai benar-benar frustrasi dengan Apple, mereka belum berinovasi dalam bertahun-tahun ketika datang ke iPhone.

Sudah mendengar rumor tentang ponsel Tesla yang katanya sedang dikerjakan oleh Elon Musk, saya tidak yakin apakah itu akan terwujud, tapi saya sangat tertarik dengan itu.";negatif;2024-10-31T15:17:27Z;2;iPhone 17;Apple;Flagship;September 9, 2025
